GS ONLY publications,GS ONLY title,GS ONLY coauthors,SV ONLY publications,SV ONLY title,SV ONLY coauthors,shared publications,shared gs title,shared sv title,shared gs coauthors,shared sv coauthors
seventhannualmeetingmonttremblantskiresortmonttremblantquebecwednesdaymarch21tosaturdaymarch242007accesstospinalcareataleof2citiesdoesthe,"Seventh Annual Meeting, Mont Tremblant Ski Resort, Mont Tremblant, Quebec, Wednesday, March 21 to Saturday March 24, 2007Access to spinal care: a tale of 2 citiesDoes the …","['Peter Cripton', 'Wolfram Tetzlaff']",,,,individualizedtrackingofselfdirectedmotorlearningingrouphousedmiceperformingaskilledleverpositioningtaskinthehomecage,Individualized tracking of self-directed motor learning in group-housed mice performing a skilled lever positioning task in the home cage,Individualized tracking of self-directed motor learning in group-housed mice performing a skilled lever positioning task in the home cage,"['Tim H. Murphy', 'Jeffrey LeDue']","['Tim H. Murphy', 'Jeffrey LeDue']"
measuringthebpoffourdopaminergictracersutilizingatissueinputfunction,Measuring the BP of four dopaminergic tracers utilizing a tissue input function,"['A Jon Stoessl', 'Vesna Sossi']",,,,exploringtheexpressionpatternsofpalmitoylatinganddepalmitoylatingenzymesinthemousebrainusingthecuratedrnaseqdatabasebrainpalmseq,Exploring the expression patterns of palmitoylating and de-palmitoylating enzymes in the mouse brain using the curated RNA-seq database BrainPalmSeq,Exploring the expression patterns of palmitoylating and de-palmitoylating enzymes in the mouse brain using the curated RNA-seq database BrainPalmSeq,"['Shernaz Bamji', 'Kurt Haas']","['Shernaz Bamji', 'Kurt Haas']"
optogeneticactivationofmousecorticalinhibitoryinterneuronsissufficienttoincreaselocalbloodflow,Optogenetic activation of mouse cortical inhibitory interneurons is sufficient to increase local blood flow,"['Tim H. Murphy', 'Jeffrey LeDue']",,,,suei178spatialanalysisofpetimagesusing3dmomentinvariants3dmi,SU‐E‐I‐178: Spatial Analysis of PET Images Using 3D Moment Invariants (3DMI),SU‐E‐I‐178: Spatial Analysis of PET Images Using 3D Moment Invariants (3DMI),"['Martin McKeown', 'Vesna Sossi']","['Martin McKeown', 'Vesna Sossi']"
alterationsindynamicbrainconnectivitypatternsinparkinsonsdisease,Alterations in Dynamic Brain Connectivity Patterns in Parkinson's Disease,"['Martin McKeown', 'Z. Jane Wang']",,,,spatiotemporalpatternsofputaminaldopamineprocessinginparkinsonsdiseaseamultitracerpositronemissiontomographystudy,Spatiotemporal patterns of putaminal dopamine processing in Parkinson’s disease: A multi-tracer positron emission tomography study,Spatiotemporal patterns of putaminal dopamine processing in Parkinson's disease: A multi-tracer positron emission tomography study,"['Martin McKeown', 'A Jon Stoessl', 'Vesna Sossi']","['Martin McKeown', 'A Jon Stoessl', 'Vesna Sossi']"
traditionalversuscomputerizedfingertappinginpatientswithparkinsonsdisease,Traditional Versus Computerized Finger Tapping in Patients with Parkinson’s Disease,"['A Jon Stoessl', 'Silke Cresswell']",,,,corticalactivitymotifsthatcorrespondtosensorymodalitiesareorganizedwithinlargersuperclusters,Cortical activity motifs that correspond to sensory modalities are organized within larger super-clusters,Cortical activity motifs that correspond to sensory modalities are organized within larger superclusters,"['Tim H. Murphy', 'Jeffrey LeDue']","['Tim H. Murphy', 'Jeffrey LeDue']"
whichitemsonthemontrealcognitiveassessmentmocainparkinsonsdiseasepredictprogressionfrommildcognitiveimpairmentmcitodementia,Which items on the Montreal Cognitive Assessment (MoCA) in Parkinson's disease predict progression from mild cognitive impairment (MCI) to dementia?,"['Martin McKeown', 'Silke Cresswell']",,,,jointpatternanalysisappliedtopetdatandvmat2imagingrevealsnewinsightsintoparkinsonsdiseaseinducedpresynapticalterations,Joint pattern analysis applied to PET DAT and VMAT2 imaging reveals new insights into Parkinson's disease induced presynaptic alterations,Joint pattern analysis applied to PET DAT and VMAT2 imaging reveals new insights into Parkinson's disease induced presynaptic alterations,"['Martin McKeown', 'A Jon Stoessl', 'Vesna Sossi']","['Martin McKeown', 'A Jon Stoessl', 'Vesna Sossi']"
leveragingthepowerof3dbrainwideimagingandmappingtoolsforbraininjuryresearchinmurinemodels,Leveraging the power of 3D brain-wide imaging and mapping tools for brain injury research in murine models,"['Tim H. Murphy', 'Peter Cripton', 'Mark Cembrowski', 'Jeffrey LeDue']",,,,locallineardiscriminantanalysislldaforgroupandregionofinterestroibasedfmrianalysis,Local linear discriminant analysis (LLDA) for group and region of interest (ROI)-based fMRI analysis,Local Linear Discriminant Analysis (LLDA) for group and region of interest (ROI)-based fMRI analysis,"['Martin McKeown', 'Z. Jane Wang']","['Martin McKeown', 'Z. Jane Wang']"
thetemporaldynamicsofrestingstateconnectivityinparkinsonsdisease,The temporal dynamics of resting state connectivity in Parkinson's disease,"['Martin McKeown', 'Z. Jane Wang', 'Silke Cresswell']",,,,progressionofdopaminergicdysfunctioninalrrk2kindredamultitracerpetstudy,Progression of dopaminergic dysfunction in a LRRK2 kindred: a multitracer PET study,Progression of dopaminergic dysfunction in a LRRK2 kindred: A multitracer PET study,"['A Jon Stoessl', 'Vesna Sossi']","['A Jon Stoessl', 'Vesna Sossi']"
effectsofintermittentthetaburststimulationoncognitivefunctioningandhippocampalvolumesinbipolardepression,Effects of intermittent theta burst stimulation on cognitive functioning and hippocampal volumes in bipolar depression,"['Fidel Vila-Rodriguez', 'Sophia Frangou']",,,,changesinagonistconcentrationdependencethatareafunctionofdurationofexposuresuggestnmethyldaspartatereceptornonsaturationduringsynapticstimulation,Changes in Agonist Concentration Dependence That Are a Function of Duration of Exposure SuggestN-Methyl-D-aspartate Receptor Nonsaturation during Synaptic Stimulation,Changes in agonist concentration dependence that are a function of duration of exposure suggest N-methyl-D-aspartate receptor nonsaturation during synaptic stimulation,"['Tim H. Murphy', 'Lynn Raymond']","['Tim H. Murphy', 'Lynn Raymond']"
impulsivestealinginparkinsonsdiseasepdthefirstcaseassociatedwithdopaminergicmedication,Impulsive stealing in Parkinson's disease (PD): The first case associated with dopaminergic medication,"['Martin McKeown', 'Silke Cresswell']",,,,anteriorbrainglucosehypometabolismpredatesdementiainprogranulinmutationcarriers,Anterior brain glucose hypometabolism predates dementia in progranulin mutation carriers,Anterior brain glucose hypometabolism predates dementia in progranulin mutation carriers,"['A Jon Stoessl', 'Ian Mackenzie', 'Vesna Sossi']","['A Jon Stoessl', 'Ian Mackenzie', 'Vesna Sossi']"
mechanismsofalterednmethyldaspartatereceptormediatedcalciumsignalingintheyacmousemodelofhuntingtonsdisease,Mechanisms of altered N-methyl-D-aspartate receptor-mediated calcium signaling in the YAC mouse model of Huntington's disease,"['Tim H. Murphy', 'Lynn Raymond']",,,,tolcaponeenhancesfoodevokeddopamineeffluxandexecutivememoryprocessesmediatedbytheratprefrontalcortex,Tolcapone enhances food-evoked dopamine efflux and executive memory processes mediated by the rat prefrontal cortex,Tolcapone enhances food-evoked dopamine efflux and executive memory processes mediated by the rat prefrontal cortex,"['Anthony Phillips', 'Jeremy Seamans']","['Anthony Phillips', 'Jeremy Seamans']"
multitracerpetjointcorrelationanalysisrevealsdiseasespecificpatternsinbothparkinsonsdiseaseandasymptomaticlrrk2mutationcarrierscomparedtohealthycontrols,Multi-tracer PET joint correlation analysis reveals disease-specific patterns in both Parkinson's disease and asymptomatic LRRK2 mutation carriers compared to healthy controls,"['A Jon Stoessl', 'Vesna Sossi']",,,,clinicalpositronemissiontomographyandpathologicalstudiesofdnajc13pn855sparkinsonism,"Clinical, positron emission tomography, and pathological studies of DNAJC13 p. N855S Parkinsonism","Clinical, positron emission tomography, and pathological studies of DNAJC13 p.N855S Parkinsonism","['A Jon Stoessl', 'Silke Cresswell', 'Vesna Sossi']","['A Jon Stoessl', 'Silke Cresswell', 'Vesna Sossi']"
pbb3imaginginparkinsoniandisordersevidenceforbindingtoabnormallyaggregatedproteinsinadditiontotauproteins,PBB3 Imaging in Parkinsonian disorders: Evidence for binding to abnormally aggregated proteins in addition to tau proteins,"['A Jon Stoessl', 'Vesna Sossi']",,,,jointamplitudeandconnectivitycompensatorymechanismsinparkinsonsdisease,Joint amplitude and connectivity compensatory mechanisms in Parkinson's disease,Joint amplitude and connectivity compensatory mechanisms in Parkinson's disease,"['Martin McKeown', 'Z. Jane Wang']","['Martin McKeown', 'Z. Jane Wang']"
correlatingsubcorticalstructureandfunctioninidiopathicparkinsonsdiseaseacrosssectionalmorphometricand18fdopapetstudy,Correlating subcortical structure and function in idiopathic Parkinson's disease: A cross-sectional morphometric and [18F]-DOPA PET study,"['A Jon Stoessl', 'Vesna Sossi']",,,,theoralandfecalmicrobiotainacanadiancohortofalzheimersdisease,The oral and fecal microbiota in a Canadian cohort of Alzheimer’s disease,The Oral and Fecal Microbiota in a Canadian Cohort of Alzheimer's Disease,"['Brian MacVicar', 'Silke Cresswell']","['Brian MacVicar', 'Silke Cresswell']"
usingtheclosedheadimpactmodelofengineeredrotationalaccelerationtostudycooccurringtraumaticbrainandspinalcordinjury,Using the Closed-Head Impact Model of Engineered Rotational Acceleration to Study Co-occurring Traumatic Brain and Spinal Cord Injury,"['Peter Cripton', 'Wolfram Tetzlaff']",,,,parcellationoffunctionalsubregionsfromfmriagraphclusteringbasedapproach,Parcellation of functional sub-regions from fMRI: A graph clustering based approach,Parcellation of functional sub-regions from fMRI: A graph clustering based approach,"['Martin McKeown', 'Z. Jane Wang']","['Martin McKeown', 'Z. Jane Wang']"
effectofaveragekineticparametersingraphicalestimationofdistributionvolumeratiosofthreereversibleligands,Effect of average kinetic parameters in graphical estimation of distribution volume ratios of three reversible ligands,"['A Jon Stoessl', 'Vesna Sossi']",,,,11cdtbzpetcorrelatesoflevodoparesponsesinasymmetricparkinsonsdisease,[11C] DTBZ‐PET correlates of levodopa responses in asymmetric Parkinson’s disease,[<sup>11</sup>C]DTBZ-PET correlates of levodopa responses in asymmetric Parkinson's disease,"['A Jon Stoessl', 'Vesna Sossi']","['A Jon Stoessl', 'Vesna Sossi']"
investigationofmutationrelatedcovariancepatterninasymptomaticcarriersofgrnandc9orf72mutationsusingf18fdgpet,Investigation of mutation related covariance pattern in asymptomatic carriers of GRN and C9ORF72 mutations using [F18]-FDG PET,"['A Jon Stoessl', 'Ian Mackenzie', 'Vesna Sossi']",,,,optogeneticmodulationofglutamatergicafferentsfromtheventralsubiculumtothenucleusaccumbenseffectsondopaminefunctionresponsevigorandlocomotoractivity,"Optogenetic modulation of glutamatergic afferents from the ventral subiculum to the nucleus accumbens: effects on dopamine function, response vigor and locomotor activity","Optogenetic modulation of glutamatergic afferents from the ventral subiculum to the nucleus accumbens: Effects on dopamine function, response vigor and locomotor activity","['Anthony Phillips', 'Jeremy Seamans']","['Anthony Phillips', 'Jeremy Seamans']"
impairedvisuallydependentlargescaleeeginformationflowsinparkinsonsdiseaseatrestp06070,"Impaired Visually-Dependent, Large-Scale EEG Information Flows in Parkinson's Disease at Rest (P06. 070)","['Martin McKeown', 'Z. Jane Wang']",,,,hiddenmarkovmultivariateautoregressivehmmmarmodelingframeworkforsurfaceelectromyographysemgdata,Hidden Markov multivariate autoregressive (HMM-mAR) modeling framework for surface electromyography (sEMG) data,Hidden Markov multivariate autoregressive (HMM-mAR) modeling framework for surface electromyography (sEMG) data,"['Martin McKeown', 'Z. Jane Wang']","['Martin McKeown', 'Z. Jane Wang']"
1114visuallydependentdirectionaleegconnectivitychangesinparkinsonsdiseaseatrest,"1.114 VISUALLY-DEPENDENT, DIRECTIONAL EEG CONNECTIVITY CHANGES IN PARKINSON'S DISEASE AT REST","['Martin McKeown', 'Z. Jane Wang']",,,,ahiddenmarkovmultivariateautoregressivehmmmarnetworkframeworkforanalysisofsurfaceemgsemgdata,"A hidden Markov, multivariate autoregressive (HMM-mAR) network framework for analysis of surface EMG (sEMG) data","A hidden Markov, multivariate autoregressive (HMM-mAR) network framework for analysis of surface EMG (sEMG) data","['Martin McKeown', 'Z. Jane Wang']","['Martin McKeown', 'Z. Jane Wang']"
strategiestoreducescanningtimeinreceptorimagingwithpositronemissiontomography,Strategies to reduce scanning time in receptor imaging with Positron Emission Tomography,"['A Jon Stoessl', 'Vesna Sossi']",,,,amultiblockplsmodelofcorticocorticalandcorticomuscularinteractionsinparkinsonsdisease,A multiblock PLS model of cortico-cortical and corticomuscular interactions in Parkinson's disease,A multiblock PLS model of cortico-cortical and corticomuscular interactions in Parkinson's disease,"['Martin McKeown', 'Z. Jane Wang']","['Martin McKeown', 'Z. Jane Wang']"
connectivitypatternsderivedfromrestingstatefmripredictbradykinesiaandrigidityinparkinsonsdisease,Connectivity patterns derived from resting state fMRI predict bradykinesia and rigidity in Parkinson's disease,"['Martin McKeown', 'Z. Jane Wang', 'Silke Cresswell']",,,,extendedtreatmentwithglialcelllinederivedneurotrophicfactorinparkinsonsdisease,Extended treatment with glial cell line-derived neurotrophic factor in Parkinson’s disease,Extended Treatment with Glial Cell Line-Derived Neurotrophic Factor in Parkinson's Disease,"['A Jon Stoessl', 'Vesna Sossi']","['A Jon Stoessl', 'Vesna Sossi']"
examiningdopaminergicandclinicaldifferencesbetweenhabitualexercisersandsedentaryindividualswithparkinsonsdisease,Examining dopaminergic and clinical differences between habitual exercisers and sedentary individuals with Parkinson's disease,"['A Jon Stoessl', 'Silke Cresswell', 'Vesna Sossi']",,,,psychoticsymptomsinfrontotemporaldementiawithtdp43tendtobeassociatedwithtypebpathology,Psychotic symptoms in frontotemporal dementia with TDP‐43 tend to be associated with type B pathology,Psychotic symptoms in frontotemporal dementia with TDP-43 tend to be associated with type B pathology,"['Fidel Vila-Rodriguez', 'Ian Mackenzie']","['Fidel Vila-Rodriguez', 'Ian Mackenzie']"
systematicphenomicsanalysisofasdassociatedgenesrevealssharedfunctionsand,Systematic phenomics analysis of ASD-associated genes reveals shared functions and,"['Paul Pavlidis', 'Kurt Haas', 'Catharine Rankin']",,,,hippocampallongtermdepressionisrequiredfortheconsolidationofspatialmemory,Hippocampal long-term depression is required for the consolidation of spatial memory,Hippocampal long-term depression is required for the consolidation of spatial memory,"['Anthony Phillips', 'Yu Tian Wang']","['Anthony Phillips', 'Yu Tian Wang']"
techniqueforquantitativeanalysisofcervicalmyelopathyusingmagneticresonanceimagingposter39,Technique for Quantitative Analysis of Cervical Myelopathy using Magnetic Resonance Imaging: Poster# 39,"['Peter Cripton', 'Wolfram Tetzlaff']",,,,sparcfromolfactoryensheathingcellsstimulatesschwanncellstopromoteneuriteoutgrowthandenhancesspinalcordrepair,SPARC from olfactory ensheathing cells stimulates Schwann cells to promote neurite outgrowth and enhances spinal cord repair,SPARC from olfactory ensheathing cells stimulates schwann cells to promote neurite outgrowth and enhances spinal cord repair,"['Wolfram Tetzlaff', 'Jane Roskams']","['Wolfram Tetzlaff', 'Jane Roskams']"
tauimaginginatypicalparkinsonismpreliminaryevidencewith11cpbb3petinpspsubjectss5001,Tau Imaging in Atypical Parkinsonism: Preliminary Evidence with [11C] PBB3 PET in PSP Subjects (S5. 001),"['A Jon Stoessl', 'Vesna Sossi']",,,,thecanadianrarediseasesmodelsandmechanismsrdmmnetworkconnectingunderstudiedgenestomodelorganisms,The Canadian rare diseases models and mechanisms (RDMM) network: connecting understudied genes to model organisms,The Canadian Rare Diseases Models and Mechanisms (RDMM) Network: Connecting Understudied Genes to Model Organisms,"['Paul Pavlidis', 'Catharine Rankin']","['Paul Pavlidis', 'Catharine Rankin']"
olfactoryensheathingcellproducedsparcmodulatesschwanncellactivationtopromoteneuriteoutgrowthandspinalcordrepair,Olfactory ensheathing cell-produced SPARC modulates Schwann cell activation to promote neurite outgrowth and spinal cord repair,"['Wolfram Tetzlaff', 'Jane Roskams']",,,,atimevaryingeigenspectrumsvmmethodforsemgclassificationofreachingmovementsinhealthyandstrokesubjects,A time-varying eigenspectrum/SVM method for sEMG classification of reaching movements in healthy and stroke subjects,A time-varying eigenspectrum / SVM method for sEMG classification of reaching movements in healthy and stroke subjects,"['Martin McKeown', 'Z. Jane Wang']","['Martin McKeown', 'Z. Jane Wang']"
clinicalcorrelatesofcomplementaryspatialpatternsin11cdtbz11cmp11cracand11cdasbpetimagesrevealedbymultisetcanonicalcorrelationanalysisin,"Clinical Correlates of Complementary Spatial Patterns in [11] C-DTBZ,[11] C-MP,[11] C-RAC, and [11] C-DASB PET Images Revealed by Multiset Canonical Correlation Analysis in …","['Martin McKeown', 'A Jon Stoessl', 'Vesna Sossi']",,,,optogeneticstimulationofgabaneuronscandecreaselocalneuronalactivitywhileincreasingcorticalbloodflow,Optogenetic stimulation of GABA neurons can decrease local neuronal activity while increasing cortical blood flow,Optogenetic stimulation of GABA neurons can decrease local neuronal activity while increasing cortical blood flow,"['Tim H. Murphy', 'Jeffrey LeDue']","['Tim H. Murphy', 'Jeffrey LeDue']"
reestablishmentofcorticalmotoroutputmapsandspontaneousfunctionalrecoveryviaspareddorsolaterallyprojectingcorticospinalneuronsafterdorsalcolumnspinalcord,Re-establishment of cortical motor output maps and spontaneous functional recovery via spared dorsolaterally projecting corticospinal neurons after dorsal column spinal cord …,"['Tim H. Murphy', 'Wolfram Tetzlaff']",,,,petinlrrk2mutationscomparisontosporadicparkinsonsdiseaseandevidenceforpresymptomaticcompensation,PET in LRRK2 mutations: comparison to sporadic Parkinson's disease and evidence for presymptomatic compensation,PET in LRRK2 mutations: Comparison to sporadic Parkinson's disease and evidence for presymptomatic compensation,"['A Jon Stoessl', 'Vesna Sossi']","['A Jon Stoessl', 'Vesna Sossi']"
scholarmetricsscrapersmsautomatedretrievalofcitationandauthordata,Scholar Metrics Scraper (SMS): automated retrieval of citation and author data,"['Tim H. Murphy', 'Jeffrey LeDue']",,,,pidoseanopensourcesystemforaccurateandautomatedoraldrugadministrationtogrouphousedmice,PiDose: an open-source system for accurate and automated oral drug administration to group-housed mice,PiDose: an open-source system for accurate and automated oral drug administration to group-housed mice,"['Tim H. Murphy', 'Lynn Raymond']","['Tim H. Murphy', 'Lynn Raymond']"
invivolargescalecorticalmappingusingchannelrhodopsin2stimulationintransgenicmicerevealsasymmetricandreciprocalrelationshipsbetween,In vivo Large-Scale Cortical Mapping Using Channelrhodopsin-2 Stimulation in Transgenic Mice Reveals Asymmetric and Reciprocal Relationships between …,"['Tim H. Murphy', 'Jeffrey LeDue']",,,,localselfrenewalcansustaincnsmicrogliamaintenanceandfunctionthroughoutadultlife,Local self-renewal can sustain CNS microglia maintenance and function throughout adult life,Local self-renewal can sustain CNS microglia maintenance and function throughout adult life,"['Wolfram Tetzlaff', 'Fabio Rossi']","['Wolfram Tetzlaff', 'Fabio Rossi']"
differencesineffectiveconnectivitybetweentremorpredominantpdtandakineticrigidpdarvariantsofparkinsonsdiseasepd,Differences in effective connectivity between tremor-predominant (PDT) and akinetic-rigid (PDAR) variants of Parkinson's disease (PD),"['Martin McKeown', 'Z. Jane Wang']",,,,irrationalchoiceunderuncertaintycorrelateswithlowerstriatald23receptorbindinginrats,Irrational choice under uncertainty correlates with lower striatal D2/3 receptor binding in rats,Irrational choice under uncertainty correlates with lower striatal D<inf>2/3</inf> receptor binding in rats,"['Catharine Winstanley', 'Vesna Sossi']","['Catharine Winstanley', 'Vesna Sossi']"
agingeffectontherateofprogressioninparkinsonsdiseaseafouryearlongitudinalpetstudy,Aging effect on the rate of progression in Parkinson's disease: A fouryear longitudinal PET study,"['A Jon Stoessl', 'Vesna Sossi']",,,,competitiveinhibitionofnmdareceptormediatedcurrentsbyextracellularcalciumchelators,Competitive Inhibition of NMDA Receptor–Mediated Currents by Extracellular Calcium Chelators,Competitive inhibition of NMDA receptor-mediated currents by extracellular calcium chelators,"['Tim H. Murphy', 'Lynn Raymond']","['Tim H. Murphy', 'Lynn Raymond']"
nucleusaccumbenslongtermdepressionandtheexpressionofbehavioralsensitization,Nucleus accumbens long-term depression and the expression of behavioral sensitization,"['Anthony Phillips', 'Yu Tian Wang']",,,,enhancedstriatalnr2bcontainingnmethyldaspartatereceptormediatedsynapticcurrentsinamousemodelofhuntingtondisease,Enhanced Striatal NR2B-Containing N-Methyl-d-Aspartate Receptor-Mediated Synaptic Currents in a Mouse Model of Huntington Disease,Enhanced striatal NR2B-containing N-methyl-D-aspartate receptor-mediated synaptic currents in a mouse model of Huntington disease,"['Tim H. Murphy', 'Lynn Raymond']","['Tim H. Murphy', 'Lynn Raymond']"
aretheregenderrelateddifferencesintheprogressionofparkinsonsdiseasefindingsfromalongitudinalc11dihydrotetrabenazinepetstudy,Are There Gender-Related Differences in the Progression of Parkinson's Disease? Findings from a Longitudinal [C-11](+/-) Dihydrotetrabenazine PET Study,"['A Jon Stoessl', 'Vesna Sossi']",,,,alteredcorticaldynamicsandcognitivefunctionuponhaploinsufficiencyoftheautismlinkedexcitatorysynapticsuppressormdga2,Altered cortical dynamics and cognitive function upon haploinsufficiency of the autism-linked excitatory synaptic suppressor MDGA2,Altered Cortical Dynamics and Cognitive Function upon Haploinsufficiency of the Autism-Linked Excitatory Synaptic Suppressor MDGA2,"['Tim H. Murphy', 'Jeffrey LeDue']","['Tim H. Murphy', 'Yu Tian Wang', 'Jeffrey LeDue']"
positionemissiontomographicstudiesoffamilyhagreekamericankindredwithautosomaldominantlevodoparesponsiveparkinsonismsecondarytoamutationofalphasynuclein,Position emission tomographic studies of family H: a Greek-American kindred with autosomal dominant levodopa responsive Parkinsonism secondary to a mutation of alpha-synuclein,"['A Jon Stoessl', 'Vesna Sossi']",,,,datadrivenvoxelbasedanalysisofbrainpetimagesapplicationofpcaandlassomethodstovisualizeandquantifypatternsofneurodegeneration,"Data-driven, voxel-based analysis of brain PET images: Application of PCA and LASSO methods to visualize and quantify patterns of neurodegeneration","Data-driven, voxel-based analysis of brain PET images: Application of PCA and LASSO methods to visualize and quantify patterns of neurodegeneration","['A Jon Stoessl', 'Vesna Sossi']","['A Jon Stoessl', 'Vesna Sossi']"
theapplicationofpetimagingtolrrk2rodentmodelsofpd,The application of PET imaging to LRRK2 rodent models of PD,"['A Jon Stoessl', 'Vesna Sossi']",,,,effectsofexpectationonplaceboinduceddopaminereleaseinparkinsondisease,Effects of expectation on placebo-induced dopamine release in Parkinson disease,Effects of expectation on placebo-induced dopamine release in Parkinson disease,"['A Jon Stoessl', 'Anthony Phillips', 'Vesna Sossi']","['A Jon Stoessl', 'Anthony Phillips', 'Vesna Sossi']"
irrationalchoiceunderriskcorrelateswithlowerstriatald23receptorbindinginrats,Irrational Choice Under Risk Correlates with Lower Striatal D2/3 Receptor Binding in Rats,"['Catharine Winstanley', 'Vesna Sossi']",,,,electroconvulsiveshockbutnottranscranialmagneticstimulationtransientlyelevatescellproliferationintheadultmousehippocampus,"Electroconvulsive shock, but not transcranial magnetic stimulation, transiently elevates cell proliferation in the adult mouse Hippocampus","Electroconvulsive shock, but not transcranial magnetic stimulation, transiently elevates cell proliferation in the adult mouse hippocampus","['Fidel Vila-Rodriguez', 'Jason Snyder']","['Fidel Vila-Rodriguez', 'Jason Snyder']"
mesoscalecorticalcalciumimagingrevealswidespreadsynchronizedinfraslowactivityduringsocialtouchinmice,Mesoscale cortical calcium imaging reveals widespread synchronized infraslow activity during social touch in mice,"['Tim H. Murphy', 'Jeffrey LeDue']",,,,asymptoticanalysisofthehuberizedlassoestimator,Asymptotic analysis of the Huberized LASSO estimator,Asymptotic analysis of the Huberized LASSO estimator,"['Martin McKeown', 'Z. Jane Wang']","['Martin McKeown', 'Z. Jane Wang']"
priorexposuretosalientwinpairedcuesinaratgamblingtaskincreasessensitivitytococaineselfadministrationandsuppressesdopamineeffluxinnucleusaccumbens,Prior exposure to salient win-paired cues in a rat gambling task increases sensitivity to cocaine self-administration and suppresses dopamine efflux in nucleus accumbens …,"['Anthony Phillips', 'Catharine Winstanley']",,,,nmdaglun2aandglun2breceptorsplayseparaterolesintheinductionofltpandltdintheamygdalaandintheacquisitionandextinctionofconditionedfear,NMDA GluN2A and GluN2B receptors play separate roles in the induction of LTP and LTD in the amygdala and in the acquisition and extinction of conditioned fear,NMDA GluN2A and GluN2B receptors play separate roles in the induction of LTP and LTD in the amygdala and in the acquisition and extinction of conditioned fear,"['Anthony Phillips', 'Yu Tian Wang']","['Anthony Phillips', 'Yu Tian Wang']"
