GS ONLY publications,GS ONLY title,GS ONLY coauthors,SV ONLY publications,SV ONLY title,SV ONLY coauthors,shared publications,shared gs title,shared sv title,shared gs coauthors,shared sv coauthors
3118investigationoftheroleofexpectationinthemechanismoftheplaceboeffectinparkinsonsdiseaseusinghighresolutionpositronemissiontomographypetwith11c,3.118 Investigation of the role of expectation in the mechanism of the placebo effect in Parkinson's disease using high-resolution positron emission tomography (PET) with [11C …,"['A Jon Stoessl', 'Vesna Sossi']",effectofdopaminelossandthemetabolite3omethyl18ffluorodopaontherelationbetweenthe18ffluorodopatissueinputuptakerateconstantkoccandthe18ffluorodopaplasmainputuptakerateconstantki,Effect of dopamine loss and the metabolite 3-O-methyl-[<sup>18</sup>F]fluoro-dopa on the relation between the <sup>18</sup>F-fluorodopa tissue input uptake rate constant K<inf>occ</inf> and the [<sup>18</sup>F]fluorodopa plasma input uptake rate constant K<inf>i</inf>,"['A Jon Stoessl', 'Vesna Sossi']",effectsofintermittentthetabursttranscranialmagneticstimulationoncognitionandhippocampalvolumesinbipolardepression,Effects of intermittent theta-burst transcranial magnetic stimulation on cognition and hippocampal volumes in bipolar depression,Effects of intermittent theta-burst transcranial magnetic stimulation on cognition and hippocampal volumes in bipolar depression,"['Fidel Vila-Rodriguez', 'Sophia Frangou']","['Fidel Vila-Rodriguez', 'Sophia Frangou']"
thesafetyandfeasibilityofmediterraneanketogenicdietaryinterventionsonguthealthinparkinsonsdiseaseaprotocolforanopenlabelrandomizedcrossoverdesign,"The Safety and Feasibility of Mediterranean-Ketogenic Dietary Interventions on Gut Health in Parkinson’s Disease: A Protocol for an Open-label, Randomized, Crossover Design …","['Wolfram Tetzlaff', 'Silke Cresswell']",partialdirectedcoherencebasedinformationflowinparkinsonsdiseasepatientsperformingavisuallyguidedmotortask,Partial directed coherence-based information flow in Parkinson's disease patients performing a visually-guided motor task,"['Martin McKeown', 'Z. Jane Wang']",whitematterbiomarkersassociatedwithmotorchangeinindividualswithstrokeacontinuousthetaburststimulationstudy,White matter biomarkers associated with motor change in individuals with stroke: a continuous theta burst stimulation study,White matter biomarkers associated with motor change in individuals with stroke: A continuous theta burst stimulation study,"['Lara Boyd', 'Todd Woodward']","['Lara Boyd', 'Todd Woodward']"
endocannabinoidspecificimpairmentinsynapticplasticityinstriatumofhuntingtonsdiseasemousemodelvol38pg5442018,"Endocannabinoid-Specific Impairment in Synaptic Plasticity in Striatum of Huntington's Disease Mouse Model (vol 38, pg 544, 2018)","['Lynn Raymond', 'Jeffrey LeDue']",bothstationaryanddynamicfunctionalinterhemisphericconnectivityarestronglyassociatedwithperformanceoncognitivetestsinmultiplesclerosis,Both Stationary and Dynamic Functional Interhemispheric Connectivity Are Strongly Associated With Performance on Cognitive Tests in Multiple Sclerosis,"['Martin McKeown', 'Z. Jane Wang']",clinicallyinformedautomatedassessmentoffingertappingvideosinparkinsonsdisease,Clinically Informed Automated Assessment of Finger Tapping Videos in Parkinson’s Disease,Clinically Informed Automated Assessment of Finger Tapping Videos in Parkinson’s Disease,"['Martin McKeown', 'Z. Jane Wang']","['Martin McKeown', 'Z. Jane Wang']"
invivopetstudiesinnormalhumansubjectsshowthatratiosofdattovmat2inthestriatumdecreasewitharostrocaudalgradientandalsowithagingimplicationsforthe,In vivo PET studies in normal human subjects show that ratios of DAT to VMAT2 in the striatum decrease with a rostrocaudal gradient and also with aging: implications for the …,"['A Jon Stoessl', 'Vesna Sossi']",neurosciencenucleusaccumbenslongtermdepressionandtheexpressionofbehavioralsensitization,Neuroscience: Nucleus accumbens long-term depression and the expression of behavioral sensitization,"['Anthony Phillips', 'Yu Tian Wang']",levodopainducedchangesinsynapticdopaminelevelsincreasewithprogressionofparkinsonsdiseaseimplicationsfordyskinesias,Levodopa-induced changes in synaptic dopamine levels increase with progression of Parkinson's disease: implications for dyskinesias,Levodopa-induced changes in synaptic dopamine levels increase with progression of Parkinson's disease: Implications for dyskinesias,"['A Jon Stoessl', 'Vesna Sossi']","['A Jon Stoessl', 'Vesna Sossi']"
ajournaldevotedtofunctionalneuroanatomyandneuroimaging,A Journal Devoted to Functional Neuroanatomy and Neuroimaging,"['Sophia Frangou', 'Randy Mcintosh']",guesteditorialforspecialsectiononmultimodalbiomedicalimagingalgorithmsandapplications,Guest editorial for special section on multimodal biomedical imaging: Algorithms and applications,"['Martin McKeown', 'Z. Jane Wang']",inductionofthenrf2drivenantioxidantresponseconfersneuroprotectionduringmitochondrialstressinvivo,Induction of the Nrf2-driven antioxidant response confers neuroprotection during mitochondrial stress in vivo,Induction of the Nrf2-driven antioxidant response confers neuroprotection during mitochondrial stress in vivo,"['Tim H. Murphy', 'Andy Shih']","['Tim H. Murphy', 'Andy Shih']"
amultivariateapproachfordenoisingoft2relaxationdecaycurvesinmyelinwaterfractionimaging,A Multivariate Approach for Denoising of T2 Relaxation Decay Curves in Myelin Water Fraction Imaging,"['Martin McKeown', 'Z. Jane Wang']",parkinsonsdiseaserigidityrelationtobrainconnectivityandmotorperformance,Parkinson's disease rigidity: Relation to brain connectivity and motor performance,"['Martin McKeown', 'Z. Jane Wang']",dctn1pk56rinprogressivesupranuclearpalsy,DCTN1 p. K56R in progressive supranuclear palsy,DCTN1 p.K56R in progressive supranuclear palsy,"['Martin McKeown', 'Silke Cresswell']","['Martin McKeown', 'A Jon Stoessl', 'Silke Cresswell']"
thecellularmechanismsofneuronalswellingunderlyingcytotoxicbrainedema,THE CELLULAR MECHANISMS OF NEURONAL SWELLING UNDERLYING CYTOTOXIC BRAIN EDEMA,"['Brian MacVicar', 'Terry Snutch']",fmrigroupstudiesofbrainconnectivityviaagrouprobustlasso,FMRI group studies of brain connectivity via a group robust LASSO,"['Martin McKeown', 'Z. Jane Wang']",anicplsframeworkforgroupcorticomuscularcouplinganalysis,An IC-PLS framework for group corticomuscular coupling analysis,An IC-PLS framework for group corticomuscular coupling analysis,"['Martin McKeown', 'Z. Jane Wang']","['Martin McKeown', 'Z. Jane Wang']"
invivochannelrhodopsin2stimulationandvoltagesensitivedyeimaginginamousemodelofstrokerevealspreservedfunctionalconnectionsposteriortothelesion,In Vivo Channelrhodopsin-2 Stimulation and Voltage-Sensitive Dye Imaging in a Mouse Model of Stroke Reveals Preserved Functional Connections Posterior to the Lesion,"['Tim H. Murphy', 'Jeffrey LeDue']",timevaryingbrainconnectivitymodelingusingfmrisignals,Time varying brain connectivity modeling using FMRI signals,"['Martin McKeown', 'Z. Jane Wang']",mesopydualbraincorticalcalciumimaginginmiceduringheadfixedsocialstimuluspresentation,Meso-py: Dual brain cortical calcium imaging in mice during head-fixed social stimulus presentation,Meso-Py: Dual Brain Cortical Calcium Imaging in Mice during Head-Fixed Social Stimulus Presentation,"['Tim H. Murphy', 'Jeffrey LeDue']","['Tim H. Murphy', 'Jeffrey LeDue']"
protectiveeffectofketogenicdietonneuropathologyandbehaviorafterrepetitivemildtraumaticbraininjuryusingchimerainjuvenilemice,Protective effect of ketogenic diet on neuropathology and behavior after repetitive mild traumatic brain injury using CHIMERA in juvenile mice,"['Peter Cripton', 'Wolfram Tetzlaff']",theuseofmultivariateemdandccafordenoisingmuscleartifactsfromfewchanneleegrecordings,The Use of Multivariate EMD and CCA for Denoising Muscle Artifacts from Few-Channel EEG Recordings,"['Martin McKeown', 'Z. Jane Wang']",noniterativemultimodalpartialviewtofullviewimageregistrationusinglocalphasebasedimageprojections,Non-iterative multi-modal partial view to full view image registration using local phase-based image projections,Non-iterative multi-modal partial view to full view image registration using local phase-based image projections,"['Ilker Hacihaliloglu', 'Purang Abolmaesumi']","['Ilker Hacihaliloglu', 'Purang Abolmaesumi']"
monitoringthefunctionalparcellationandtopographywithmesoscopiccalciumimagingofrestingstatecorticalactivitityinmice,Monitoring the functional parcellation and topography with mesoscopic calcium imaging of resting state cortical activitity in mice,"['Tim H. Murphy', 'Jeffrey LeDue']",,,,longitudinalevolutionofcompensatorychangesinstriataldopamineprocessinginparkinsonsdisease,Longitudinal evolution of compensatory changes in striatal dopamine processing in Parkinson's disease,Longitudinal evolution of compensatory changes in striatal dopamine processing in Parkinson's disease,"['A Jon Stoessl', 'Vesna Sossi']","['A Jon Stoessl', 'Vesna Sossi']"
decreasedactivationinafunctionallyconnectedmotornetworkfollowingmotorsequencelearningaftersubcorticalstroke,Decreased activation in a functionally connected motor network following motor sequence learning after subcortical stroke,"['Lara Boyd', 'Todd Woodward']",,,,increaseindopamineturnoveroccursearlyinparkinsonsdiseaseevidencefromanewmodelingapproachtopet18ffluorodopadata,Increase in Dopamine Turnover Occurs Early in Parkinson's Disease: Evidence from a New Modeling Approach to PET 18F-Fluorodopa Data,Increase in dopamine turnover occurs early in Parkinson's disease: Evidence from a new modeling approach to PET <sup>18</sup>F-fluorodopa data,"['A Jon Stoessl', 'Vesna Sossi']","['A Jon Stoessl', 'Vesna Sossi']"
compensatoryremappingoffmrifunctionalconnectivityduringrestingstateinmultiplesclerosis,Compensatory remapping of fMRI functional connectivity during resting state in multiple sclerosis,"['Martin McKeown', 'Z. Jane Wang']",,,,automaticlabelingofparkinsonsdiseasegaitvideoswithweaksupervision,Automatic labeling of Parkinson’s Disease gait videos with weak supervision,Automatic labeling of Parkinson's Disease gait videos with weak supervision,"['Martin McKeown', 'Z. Jane Wang']","['Martin McKeown', 'Z. Jane Wang']"
developmentofamousemodelofdiffusemicroinfarctionandautomatedassessmenttoolsformonitoringrecovery,Development of a Mouse Model of Diffuse Microinfarction and Automated Assessment Tools for Monitoring Recovery,"['Tim H. Murphy', 'Jeffrey LeDue']",,,,stressimpactssensoryvariabilitythroughcorticalsensoryactivitymotifs,Stress impacts sensory variability through cortical sensory activity motifs,Stress impacts sensory variability through cortical sensory activity motifs,"['Tim H. Murphy', 'Jeffrey LeDue']","['Tim H. Murphy', 'Jeffrey LeDue']"
thedopamineeffectivedistributionvolumeagoodclassifyingestimatorofearlyparkinsonsdisease,The dopamine effective distribution volume: A good classifying estimator of early Parkinson's disease.,"['A Jon Stoessl', 'Vesna Sossi']",,,,studyofstrokeconditionandhanddominanceusingahiddenmarkovmultivariateautoregressivehmmmarnetworkframework,"Study of stroke condition and hand dominance using a hidden Markov, multivariate autoregressive (HMM-mAR) network framework","Study of stroke condition and hand dominance using a hidden Markov, multivariate autoregressive (HMM-mAR) network framework","['Martin McKeown', 'Z. Jane Wang']","['Martin McKeown', 'Z. Jane Wang']"
p38mapkisinvolvedinenhancednmdareceptordependentexcitotoxicityinyactransgenicmousemodelofhuntingtondisease,P38 MAPK is involved in enhanced NMDA receptor-dependent excitotoxicity in YAC transgenic mouse model of Huntington disease,"['Yu Tian Wang', 'Lynn Raymond']",,,,novelspatialanalysismethodforpetimagesusing3dmomentinvariantsapplicationstoparkinsonsdisease,Novel spatial analysis method for PET images using 3D moment invariants: Applications to Parkinson's disease,Novel spatial analysis method for PET images using 3D moment invariants: Applications to Parkinson's disease,"['Martin McKeown', 'A Jon Stoessl', 'Silke Cresswell', 'Vesna Sossi']","['Martin McKeown', 'A Jon Stoessl', 'Silke Cresswell', 'Vesna Sossi']"
semipflpersonalizedsemisupervisedfederatedlearningframeworkforedgeintelligence,SemiPFL: Personalized Semi-Supervised Federated Learning Framework for Edge Intelligence,"['Z. Jane Wang', 'Peyman Servati']",,,,constructingpreciselycomputingnetworkswithbiophysicalspikingneurons,Constructing precisely computing networks with biophysical spiking neurons,Constructing precisely computing networks with biophysical spiking neurons,"['Adrienne Fairhall', 'Eric Shea-Brown']","['Adrienne Fairhall', 'Eric Shea-Brown']"
striatalandcorticalelevationsinserotonintransporterbindingprecedemotoronsetinasymptomaticpatientswithlrrk2genemutations,Striatal and cortical elevations in serotonin transporter binding precede motor onset in asymptomatic patients with lrrk2 gene mutations,"['A Jon Stoessl', 'Vesna Sossi']",,,,icadenoisingforeventrelatedfmristudies,ICA denoising for event-related fMRI studies,ICA denoising for event-related fMRI studies,"['Martin McKeown', 'Z. Jane Wang']","['Martin McKeown', 'Z. Jane Wang']"
longitudinalmonitoringofmesoscopiccorticalactivityusingafluorescentbeadmousemodelofsmallvesseldiseaseandgcamp6imaging,Longitudinal monitoring of mesoscopic cortical activity using a fluorescent bead mouse model of small vessel disease and GCaMP6 imaging,"['Tim H. Murphy', 'Jeffrey LeDue']",,,,cellpalmseqacuratedrnaseqdatabaseofpalmitoylatinganddepalmitoylatingenzymeexpressioninhumancelltypesandlaboratorycelllines,CellPalmSeq: A curated RNAseq database of palmitoylating and de-palmitoylating enzyme expression in human cell types and laboratory cell lines,CellPalmSeq: A curated RNAseq database of palmitoylating and de-palmitoylating enzyme expression in human cell types and laboratory cell lines,"['Shernaz Bamji', 'Kurt Haas']","['Shernaz Bamji', 'Kurt Haas']"
impactofdifferentrealignmentalgorithmsonthespmanalysisofsup11craclopridepetstudies,Impact of different realignment algorithms on the SPM analysis of [/sup 11/C] raclopride PET studies,"['A Jon Stoessl', 'Vesna Sossi']",,,,boneenhancementinultrasoundusinglocalspectrumvariationsforguidingpercutaneousscaphoidfracturefixationprocedures,Bone enhancement in ultrasound using local spectrum variations for guiding percutaneous scaphoid fracture fixation procedures,Bone enhancement in ultrasound using local spectrum variations for guiding percutaneous scaphoid fracture fixation procedures,"['Ilker Hacihaliloglu', 'Purang Abolmaesumi']","['Ilker Hacihaliloglu', 'Purang Abolmaesumi']"
longitudinalchangesincaudatedopamineprocessinginparkinsonsdiseaseamultitracerpetstudys33005,Longitudinal Changes in Caudate Dopamine Processing in Parkinson's Disease: A Multi-Tracer PET Study (S33. 005),"['A Jon Stoessl', 'Vesna Sossi']",,,,amultivertebraecttousregistrationofthelumbarspineinclinicaldata,A multi-vertebrae CT to US registration of the lumbar spine in clinical data,A multi-vertebrae CT to US registration of the lumbar spine in clinical data,"['Ilker Hacihaliloglu', 'Purang Abolmaesumi']","['Ilker Hacihaliloglu', 'Purang Abolmaesumi']"
abayesiannetworkapproachforpredictionoffuturedementiainparkinsonsdisease,A bayesian network approach for prediction of future dementia in Parkinson's disease,"['Martin McKeown', 'Silke Cresswell']",,,,cadherinsmediatecocaineinducedsynapticplasticityandbehavioralconditioning,Cadherins mediate cocaine-induced synaptic plasticity and behavioral conditioning,Cadherins mediate cocaine-induced synaptic plasticity and behavioral conditioning,"['Shernaz Bamji', 'Anthony Phillips']","['Shernaz Bamji', 'Anthony Phillips']"
sharelink,Share Link,"['Terry Snutch', 'Catharine Rankin']",,,,hippocampallongtermdepressionmediatesacutestressinducedspatialmemoryretrievalimpairment,Hippocampal long-term depression mediates acute stress-induced spatial memory retrieval impairment,Hippocampal long-term depression mediates acute stress-induced spatial memory retrieval impairment,"['Anthony Phillips', 'Yu Tian Wang']","['Anthony Phillips', 'Yu Tian Wang']"
decisionsunderriskinparkinsonsdiseaseevaluatingprobabilityandmagnitudeforgainandloss,Decisions under risk in Parkinson's disease: Evaluating probability and magnitude for gain and loss,"['Martin McKeown', 'A Jon Stoessl', 'Silke Cresswell']",,,,anfdrcontrolledexploratorygroupmodelingforassessingbrainconnectivity,"An FDR-controlled, exploratory group modeling for assessing brain connectivity","An FDR-controlled, exploratory group modeling for assessing brain connectivity","['Martin McKeown', 'Z. Jane Wang']","['Martin McKeown', 'Z. Jane Wang']"
reshapingthepathofmildcognitiveimpairmentbyrefiningexerciseprescriptionastudyprotocolofarandomizedcontrolledtrialtounderstandthewhatforwhomand,"Reshaping the path of mild cognitive impairment by refining exercise prescription: a study protocol of a randomized controlled trial to understand the “what,”“for whom,” and …","['Lara Boyd', 'Liisa Galea']",,,,aselectiverolefordopamineinthenucleusaccumbensoftheratinrandomforagingbutnotdelayedspatialwinshiftbasedforaging,A selective role for dopamine in the nucleus accumbens of the rat in random foraging but not delayed spatial win-shift-based foraging,A selective role for dopamine in the nucleus accumbens of the rat in random foraging but not delayed spatial win-shift-based foraging,"['Anthony Phillips', 'Jeremy Seamans']","['Anthony Phillips', 'Jeremy Seamans']"
screeningforcognitiveimpairmentwiththemontrealcognitiveassessmentinparkinsonsdiseasepatients,Screening for Cognitive Impairment with the Montreal Cognitive Assessment in Parkinson's Disease Patients,"['A Jon Stoessl', 'Silke Cresswell']",,,,ministrokesinchannelrhodopsin2transgenicmicerevealwidespreaddeficitsinmotoroutputdespitemaintenanceofcorticalneuronalexcitability,Ministrokes in channelrhodopsin-2 transgenic mice reveal widespread deficits in motor output despite maintenance of cortical neuronal excitability,Ministrokes in channelrhodopsin-2 transgenic mice reveal widespread deficits in motor output despite maintenance of cortical neuronal excitability,"['Tim H. Murphy', 'Wolfram Tetzlaff']","['Tim H. Murphy', 'Wolfram Tetzlaff']"
ajournaldevotedtofuncঞonalneuroanatomyandneuroimaging,A Journal Devoted to Funcঞonal Neuroanatomy and Neuroimaging,"['Sophia Frangou', 'Randy Mcintosh']",,,,athreedimensionalvirtualmousegeneratessynthetictrainingdataforbehavioralanalysis,A three-dimensional virtual mouse generates synthetic training data for behavioral analysis,A three-dimensional virtual mouse generates synthetic training data for behavioral analysis,"['Tim H. Murphy', 'Helge Rhodin', 'Jeffrey LeDue']","['Tim H. Murphy', 'Helge Rhodin', 'Jeffrey LeDue']"
comparisonbetweenthebmaxkdplasmainputandtissueinputderivedestimatesofindtbzstudiesofparkinsons,Comparison between the Bmax/Kd Plasma Input and Tissue Input Derived Estimates of in DTBZ Studies of Parkinson's,"['A Jon Stoessl', 'Vesna Sossi']",,,,positronemissiontomographyafterfetaltransplantationinhuntingtonsdisease,Positron emission tomography after fetal transplantation in Huntington's disease,Positron emission tomography after fetal transplantation in Huntington's disease,"['A Jon Stoessl', 'Vesna Sossi']","['A Jon Stoessl', 'Vesna Sossi']"
invivovoltagesensitivedyeimaginginadultmicerevealsthatsomatosensorymapslosttostrokearereplacedoverweeksbynewstructuralandfunctionalcircuitswith,In vivo voltage-sensitive dye imaging in adult mice reveals that somatosensory maps lost to stroke are replaced over weeks by new structural and functional circuits with …,"['Tim H. Murphy', 'Craig E. Brown']",,,,pqtypecalciumchannelsmediatetheactivitydependentfeedbackofsyntaxin1a,P/Q-type calcium channels mediate the activity-dependent feedback of syntaxin-1A,P/Q-type calcium channels mediate the activity-dependent feedback of syntaxin-1A,"['Tim H. Murphy', 'Terry Snutch']","['Tim H. Murphy', 'Terry Snutch']"
methodsoftreatingbrainedema,Methods of treating brain edema,"['Brian MacVicar', 'Terry Snutch']",,,,homozygousalphasynucleinpa53vinfamilialparkinsonsdisease,Homozygous alpha-synuclein p. A53V in familial Parkinson's disease,Homozygous alpha-synuclein p.A53V in familial Parkinson's disease,"['A Jon Stoessl', 'Vesna Sossi']","['A Jon Stoessl', 'Vesna Sossi']"
ajournaldevotedtofunconalneuroanatomyandneuroimaging,A Journal Devoted to Funconal Neuroanatomy and Neuroimaging,"['Sophia Frangou', 'Randy Mcintosh']",,,,phosphorylatedαsynucleininparkinsonsdiseasecorrelationdependsondiseaseseverity,Phosphorylated α-synuclein in Parkinson’s disease: correlation depends on disease severity,Phosphorylated α-synuclein in Parkinson's disease: correlation depends on disease severity,"['A Jon Stoessl', 'Vesna Sossi']","['A Jon Stoessl', 'Vesna Sossi']"
molecularimagingcorrelatesofsleepdysfunctioninparkinsonsdiseasepd,Molecular imaging correlates of sleep dysfunction in Parkinson's disease (PD),"['A Jon Stoessl', 'Vesna Sossi']",,,,radiographyusedtomeasureinternalspinalcorddeformationinaninvivoratmodel,Radiography used to measure internal spinal cord deformation in an in vivo rat model,Radiography used to measure internal spinal cord deformation in an in vivo rat model,"['Peter Cripton', 'Wolfram Tetzlaff']","['Peter Cripton', 'Wolfram Tetzlaff']"
novelvoxelwiseresidualanalysisof11craclopridepetdataimprovesdetectionoflowamplitudedopaminerelease,Novel voxelwise residual analysis of [11C]raclopride PET data improves detection of low-amplitude dopamine release,"['A Jon Stoessl', 'Vesna Sossi']",,,,ca2transientsinastrocytefineprocessesoccurviaca2influxintheadultmousehippocampus,Ca2+ transients in astrocyte fine processes occur via Ca2+ influx in the adult mouse hippocampus,Ca<sup>2+</sup> transients in astrocyte fine processes occur via Ca<sup>2+</sup> influx in the adult mouse hippocampus,"['Brian MacVicar', 'Jeffrey LeDue']","['Brian MacVicar', 'Jeffrey LeDue']"
invivomesoscalevoltageimagingofcorticaldynamicsasaplatformforinvestigatingmousemodelsofneurodegenerativeandpsychiatricdisease,"IN VIVO, MESOSCALE VOLTAGE IMAGING OF CORTICAL DYNAMICS AS A PLATFORM FOR INVESTIGATING MOUSE MODELS OF NEURODEGENERATIVE AND PSYCHIATRIC DISEASE","['Tim H. Murphy', 'Yu Tian Wang', 'Jeffrey LeDue']",,,,ltdisinvolvedintheformationandmaintenanceofrathippocampalca1placecellfields,LTD is involved in the formation and maintenance of rat hippocampal CA1 place-cell fields,LTD is involved in the formation and maintenance of rat hippocampal CA1 place-cell fields,"['Anthony Phillips', 'Yu Tian Wang', 'Jeremy Seamans']","['Anthony Phillips', 'Yu Tian Wang', 'Jeremy Seamans']"
patternsofmorphologicalchangeinbasalgangliabgstructuresinparkinsonsdiseasepd,Patterns of morphological change in basal ganglia (BG) structures in Parkinson's disease (PD),"['Martin McKeown', 'Silke Cresswell']",,,,longitudinalinvivoimagingrevealsbalancedandbranchspecificremodelingofmaturecorticalpyramidaldendriticarborsafterstroke,Longitudinal in vivo Imaging Reveals Balanced and Branch-Specific Remodeling of Mature Cortical Pyramidal Dendritic Arbors after Stroke,Longitudinal in vivo imaging reveals balanced and branch-specific remodeling of mature cortical pyramidal dendritic arbors after stroke,"['Tim H. Murphy', 'Craig E. Brown']","['Tim H. Murphy', 'Craig E. Brown']"
optogeneticmappingafterstrokerevealsnetworkwidescalingoffunctionalconnectionsandheterogeneousrecoveryoftheperiinfarctdecemberpg164552014,"Optogenetic mapping after stroke reveals network-wide scaling of functional connections and heterogeneous recovery of the peri-infarct (December, pg 16455, 2014)","['Tim H. Murphy', 'Jeffrey LeDue']",,,,dopaminetransporterrelationtodopamineturnoverinparkinsonsdiseaseapositronemissiontomographystudy,Dopamine transporter relation to dopamine turnover in Parkinson's disease: a positron emission tomography study,Dopamine transporter relation to dopamine turnover in Parkinson's disease: A positron emission tomography study,"['A Jon Stoessl', 'Vesna Sossi']","['A Jon Stoessl', 'Vesna Sossi']"
standardized3dtestobjectformulticameracalibrationduringanimalposecapture,Standardized 3D test object for multi-camera calibration during animal pose capture,"['Tim H. Murphy', 'Helge Rhodin']",,,,lackofregionalselectivityduringtheprogressionofparkinsondiseaseimplicationsforpathogenesis,Lack of regional selectivity during the progression of Parkinson disease: implications for pathogenesis,Lack of regional selectivity during the progression of Parkinson disease: Implications for pathogenesis,"['A Jon Stoessl', 'Vesna Sossi']","['A Jon Stoessl', 'Vesna Sossi']"
compensatorymechanismsinthedopaminesystemofpatientswithdominantlyinheritedparkinsonism,Compensatory mechanisms in the dopamine system of patients with dominantly inherited parkinsonism,"['A Jon Stoessl', 'Vesna Sossi']",,,,competitionbetweenphasicandasynchronousreleaseforrecoveredsynapticvesiclesatdevelopinghippocampalautapticsynapses,Competition between phasic and asynchronous release for recovered synaptic vesicles at developing hippocampal autaptic synapses,Competition between Phasic and Asynchronous Release for Recovered Synaptic Vesicles at Developing Hippocampal Autaptic Synapses,"['Tim H. Murphy', 'Lynn Raymond']","['Tim H. Murphy', 'Lynn Raymond']"
graphicalmodelsoffunctionalmridataforassessingbrainconnectivity,Graphical Models of Functional MRI Data for Assessing Brain Connectivity,"['Martin McKeown', 'Z. Jane Wang']",,,,asmallmoleculeinduciblenrf2mediatedantioxidantresponseprovideseffectiveprophylaxisagainstcerebralischemiainvivo,A small-molecule-inducible Nrf2-mediated antioxidant response provides effective prophylaxis against cerebral ischemia in vivo,A small-molecule-inducible Nrf2-mediated antioxidant response provides effective prophylaxis against cerebral ischemia in vivo,"['Tim H. Murphy', 'Andy Shih']","['Tim H. Murphy', 'Andy Shih']"
