GS ONLY publications,GS ONLY title,GS ONLY coauthors,SV ONLY publications,SV ONLY title,SV ONLY coauthors,shared publications,shared gs title,shared sv title,shared gs coauthors,shared sv coauthors
brainpericytesandperivascularfibroblastsarestromalprogenitorsthatcoordinatecerebrovascularregenerationafterstroke,Brain pericytes and perivascular fibroblasts are stromal progenitors that coordinate cerebrovascular regeneration after stroke,"['Brian MacVicar', 'Fabio Rossi']",,,,noveldatadrivenequationfreemethodcapturesspatiotemporalpatternsofneurodegenerationinparkinsonsdiseaseapplicationofdynamicmodedecompositiontopet,"Novel data-driven, equation-free method captures spatio-temporal patterns of neurodegeneration in Parkinson's disease: Application of dynamic mode decomposition to PET","Novel data-driven, equation-free method captures spatio-temporal patterns of neurodegeneration in Parkinson's disease: Application of dynamic mode decomposition to PET","['Martin McKeown', 'A Jon Stoessl', 'Vesna Sossi']","['Martin McKeown', 'A Jon Stoessl', 'Vesna Sossi']"
differingbiologicalsubstratesofmanualtrackingperformanceinparkinsonsdiseasesubtypes,Differing biological substrates of manual tracking performance in Parkinson's disease subtypes,"['Martin McKeown', 'Z. Jane Wang']",,,,aheartbeatratedetectionframeworkusingmultiplenanofibersensorsignals,A heart beat rate detection framework using multiple nanofiber sensor signals,A heart beat rate detection framework using multiple nanofiber sensor signals,"['Martin McKeown', 'Z. Jane Wang', 'Peyman Servati']","['Martin McKeown', 'Peyman Servati']"
autosomaldominantparkinsonismassociatedwithanewlydescribedmutationindnajc13clinicalimagingandpathologicaldescriptions13002,"Autosomal-Dominant Parkinsonism Associated with a Newly Described Mutation in DNAJC13: Clinical, Imaging and Pathological Description (S13. 002)","['A Jon Stoessl', 'Silke Cresswell', 'Vesna Sossi']",,,,synapticdysfunctioninprogranulindeficientmice,Synaptic dysfunction in progranulin-deficient mice,Synaptic dysfunction in progranulin-deficient mice,"['Ian Mackenzie', 'Lynn Raymond']","['Ian Mackenzie', 'Lynn Raymond']"
apathyinparkinsonsdiseaseisassociatedwithabnormalalphaoscillatorybehaviourduringincentivizedmovement,Apathy in Parkinson's disease is associated with abnormal alpha oscillatory behaviour during incentivized movement,"['Martin McKeown', 'Silke Cresswell']",,,,functionalneuroimaginginparkinsonsdisease,Functional neuroimaging in Parkinson's disease,Functional neuroimaging in Parkinson's disease,"['Silke Cresswell', 'Vesna Sossi']","['Silke Cresswell', 'Vesna Sossi']"
presymptomaticc9orf72mutationcarriersshowadiffusepatternofglucosemetabolicreductionson18ffdgpetimaging,Presymptomatic C9ORF72 mutation carriers show a diffuse pattern of glucose metabolic reductions on [18] F-FDG-PET imaging,"['A Jon Stoessl', 'Ian Mackenzie', 'Vesna Sossi']",,,,contributionofcalciumdependentfacilitationtosynapticplasticityrevealedbymigrainemutationsinthepqtypecalciumchannel,Contribution of calcium-dependent facilitation to synaptic plasticity revealed by migraine mutations in the P/Q-type calcium channel,Contribution of calcium-dependent facilitation to synaptic plasticity revealed by migraine mutations in the P/Q-type calcium channel,"['Brian MacVicar', 'Terry Snutch']","['Brian MacVicar', 'Terry Snutch']"
heterogeneousseverityoflesionsinthestriatumofpatientswithparkinsonsdiseaseinvivopetstudiesusingdihydrotetrabenazinemethyphenidateandfdopa,"Heterogeneous severity of lesions in the striatum of patients with Parkinson's disease: In vivo PET studies using dihydrotetrabenazine, methyphenidate and F-DOPA","['A Jon Stoessl', 'Vesna Sossi']",,,,structuralnetworkanalysisusingdiffusionmritractographyinparkinsonsdiseaseandcorrelationswithmotorimpairment,Structural network analysis using diffusion MRI tractography in Parkinson's disease and correlations with motor impairment,Structural Network Analysis Using Diffusion MRI Tractography in Parkinson's Disease and Correlations With Motor Impairment,"['Martin McKeown', 'Silke Cresswell']","['Martin McKeown', 'Silke Cresswell']"
asingleboutofcyclingexerciseimprovesmoodandmotorfunctioninparkinsonsdisease,A single bout of cycling exercise improves mood and motor function in Parkinson's disease,"['Martin McKeown', 'Silke Cresswell']",,,,trackingprogresstowardagoalincorticostriatalensembles,Tracking progress toward a goal in corticostriatal ensembles,Tracking progress toward a goal in corticostriatal ensembles,"['Anthony Phillips', 'Jeremy Seamans']","['Anthony Phillips', 'Jeremy Seamans']"
reduceddorsolateralputaminalconnectivityinrestingstatefmriinparkinsonsdisease,Reduced dorsolateral putaminal connectivity in resting state FMRI in Parkinson's disease,"['Martin McKeown', 'Z. Jane Wang']",,,,multimodelfunctionalizationofdiseaseassociatedptenmissensemutationsidentifiesmultiplemolecularmechanismsunderlyingproteindysfunction,Multi-model functionalization of disease-associated PTEN missense mutations identifies multiple molecular mechanisms underlying protein dysfunction,Multi-model functionalization of disease-associated PTEN missense mutations identifies multiple molecular mechanisms underlying protein dysfunction,"['Shernaz Bamji', 'Paul Pavlidis', 'Kurt Haas', 'Catharine Rankin']","['Shernaz Bamji', 'Paul Pavlidis', 'Kurt Haas', 'Catharine Rankin']"
longitudinalassessmentofwaterreachingrevealsalteredcorticalactivityandfinemotorcoordinationdefectsinahuntingtondiseasemodel,Longitudinal assessment of water-reaching reveals altered cortical activity and fine motor coordination defects in a Huntington Disease model,"['Tim H. Murphy', 'Lynn Raymond']",,,,modellingmicroglialinnateimmunememoryinvitrounderstandingtheroleofaerobicglycolysisininnateimmunememory,Modelling Microglial Innate Immune Memory In Vitro: Understanding the Role of Aerobic Glycolysis in Innate Immune Memory,Modelling Microglial Innate Immune Memory In Vitro: Understanding the Role of Aerobic Glycolysis in Innate Immune Memory,"['Annie Ciernia', 'Brian MacVicar']","['Annie Ciernia', 'Brian MacVicar']"
the3rdjointsymposiumoftheinternationalandnationalneurotraumasocietiesandaanscnssectiononneurotraumaandcriticalcareaugust11162018torontocanada,"The 3rd Joint Symposium of the International and National Neurotrauma Societies and AANS/CNS Section on Neurotrauma and Critical Care August 11–16, 2018 Toronto, Canada","['Peter Cripton', 'Wolfram Tetzlaff']",,,,evaluationofthewistarkyotoratmodelofdepressionandtheroleofsynapticplasticityindepressionandantidepressantresponse,Evaluation of the Wistar-Kyoto rat model of depression and the role of synaptic plasticity in depression and antidepressant response,Evaluation of the Wistar-Kyoto rat model of depression and the role of synaptic plasticity in depression and antidepressant response,"['Anthony Phillips', 'Yu Tian Wang']","['Anthony Phillips', 'Yu Tian Wang']"
characterizingamurinemodeltodiagnoseandstudyconcomitantspinalcordandbraininjuriesdocooccurringinjuriesaffectdeficits,CHARACTERIZING A MURINE MODEL TO DIAGNOSE AND STUDY CONCOMITANT SPINAL CORD AND BRAIN INJURIES: DO CO-OCCURRING INJURIES AFFECT DEFICITS?,"['Peter Cripton', 'Wolfram Tetzlaff']",,,,improvedmethodsforchroniclightbasedmotormappinginmiceautomatedmovementtrackingwithaccelerometersandchroniceegrecordinginabilateralthinskullpreparation,"Improved methods for chronic light-based motor mapping in mice: automated movement tracking with accelerometers, and chronic EEG recording in a bilateral thin-skull preparation","Improved methods for chronic light-based motor mapping in mice: Automated movement tracking with accelerometers, and chronic EEG recording in a bilateral thin-skull preparation","['Tim H. Murphy', 'Jeffrey LeDue']","['Tim H. Murphy', 'Jeffrey LeDue']"
amultimodaldatafusionapproachefficientlypredictsdiseasedurationinmultiplesclerosis,A Multimodal data fusion approach efficiently predicts disease duration in multiple sclerosis,"['Martin McKeown', 'Z. Jane Wang']",,,,altereddirectionalconnectivityinparkinsonsdiseaseduringperformanceofavisuallyguidedtask,Altered directional connectivity in Parkinson's disease during performance of a visually guided task,Altered directional connectivity in Parkinson's disease during performance of a visually guided task,"['Martin McKeown', 'Z. Jane Wang']","['Martin McKeown', 'Z. Jane Wang']"
brainglucosemetabolicabnormalitiesdifferbetweenpredementiacarriersofgrnandc9orf72mutations,Brain glucose metabolic abnormalities differ between predementia carriers of GRN and C9ORF72 mutations,"['A Jon Stoessl', 'Ian Mackenzie', 'Vesna Sossi']",,,,actionandoutcomeactivitystatepatternsintheanteriorcingulatecortex,Action and outcome activity state patterns in the anterior cingulate cortex,Action and outcome activity state patterns in the anterior cingulate cortex,"['Jeremy Seamans', 'Todd Woodward']","['Jeremy Seamans', 'Todd Woodward']"
glialcelllinederivedneurotrophicfactorgdnfinparkinsonsemergingevidenceofclinicalbenefit,Glial Cell Line-Derived Neurotrophic Factor (GDNF) in Parkinson's: Emerging Evidence of Clinical Benefit,"['A Jon Stoessl', 'Vesna Sossi']",,,,sexeffectsoncorticalmorphologicalnetworksinhealthyyoungadults,Sex effects on cortical morphological networks in healthy young adults,Sex effects on cortical morphological networks in healthy young adults,"['Fidel Vila-Rodriguez', 'Sophia Frangou']","['Fidel Vila-Rodriguez', 'Sophia Frangou']"
s10203generationandcharacterizationofamousemodelofprogranulindeficiency,S1‐02‐03: Generation and characterization of a mouse model of progranulin deficiency,"['Ian Mackenzie', 'Lynn Raymond']",,,,psychiatricmotorandautonomiceffectsofbifrontalectindepressedparkinsonsdiseasepatients,"Psychiatric, Motor, and Autonomic Effects of Bifrontal ECT in Depressed Parkinson’s Disease Patients","Psychiatric, motor, and autonomic effects of bifrontal ect in depressed parkinson’s disease patients","['Fidel Vila-Rodriguez', 'Silke Cresswell']","['Fidel Vila-Rodriguez', 'Silke Cresswell']"
catalogingthepotentialfunctionaldiversityofcacna1esplicevariantsusinglongreadsequencing,Cataloging the potential functional diversity of Cacna1e splice variants using long-read sequencing,"['Paul Pavlidis', 'Terry Snutch']",,,,advancesinimaginginparkinsonsdisease,Advances in imaging in Parkinson's disease,Advances in imaging in Parkinson's disease,"['Martin McKeown', 'A Jon Stoessl', 'Vesna Sossi']","['Martin McKeown', 'A Jon Stoessl', 'Vesna Sossi']"
functionalscreenforsynapticorganizersidentificationoftrkcptpsigmaandslitrkcandidategenesinneuropsychiatricdisorders,"FUNCTIONAL SCREEN FOR SYNAPTIC ORGANIZERS: IDENTIFICATION OF TRKC-PTP sigma AND SLITRK, CANDIDATE GENES IN NEUROPSYCHIATRIC DISORDERS","['Tim H. Murphy', 'Yu Tian Wang']",,,,temporaldynamicsofhippocampalandmedialprefrontalcortexinteractionsduringthedelayperiodofaworkingmemoryguidedforagingtask,Temporal dynamics of hippocampal and medial prefrontal cortex interactions during the delay period of a working memory-guided foraging task,Temporal Dynamics of Hippocampal and Medial Prefrontal Cortex Interactions during the Delay Period of a Working Memory-Guided Foraging Task,"['Anthony Phillips', 'Jeremy Seamans']","['Anthony Phillips', 'Jeremy Seamans']"
rigidityinparkinsonsdiseaseisassociatedwithadistributedmotorsubnetwork,Rigidity in Parkinson's disease is associated with a distributed motor subnetwork,"['Martin McKeown', 'Z. Jane Wang']",,,,informationtheoreticapproachestounderstandingcircuitfunction,Information theoretic approaches to understanding circuit function,Information theoretic approaches to understanding circuit function,"['Adrienne Fairhall', 'Eric Shea-Brown']","['Adrienne Fairhall', 'Eric Shea-Brown']"
effectsofthecapacityofdopaminesequestrationontherateofprogressioninparkinsonsdisease,Effects of the capacity of dopamine sequestration on the rate of progression in Parkinson's disease,"['A Jon Stoessl', 'Vesna Sossi']",,,,dopaminetransporterpetinnormalagingdopaminetransporterdeclineanditspossibleroleinpreservationofmotorfunction,Dopamine transporter PET in normal aging: dopamine transporter decline and its possible role in preservation of motor function,Dopamine transporter PET in normal aging: Dopamine transporter decline and its possible role in preservation of motor function,"['A Jon Stoessl', 'Vesna Sossi']","['A Jon Stoessl', 'Vesna Sossi']"
determiningthepathogenicityofavariantinmef2cinanindividualwithautismspectrumdisorderidentifiedthroughatargetedchildhoodepilepsypanel,Determining the Pathogenicity of a Variant in MEF2C in an Individual with Autism Spectrum Disorder Identified through a Targeted Childhood Epilepsy Panel,"['Shernaz Bamji', 'Kurt Haas']",,,,longitudinalmonitoringofmesoscopiccorticalactivityinamousemodelofmicroinfarctsrevealsdissociationswithbehavioralandmotorfunction,Longitudinal monitoring of mesoscopic cortical activity in a mouse model of microinfarcts reveals dissociations with behavioral and motor function,Longitudinal monitoring of mesoscopic cortical activity in a mouse model of microinfarcts reveals dissociations with behavioral and motor function,"['Tim H. Murphy', 'Jeffrey LeDue']","['Tim H. Murphy', 'Jeffrey LeDue']"
ôøåòùöôø,ÔØ Å ÒÙ× Ö ÔØ,"['Paul Pavlidis', 'Sophia Frangou', 'Vesna Sossi']",,,,controllingthefalsediscoveryrateinmodelingbrainfunctionalconnectivity,Controlling the false discovery rate in modeling brain functional connectivity,Controlling the false discovery rate in modeling brain functional connectivity,"['Martin McKeown', 'Z. Jane Wang']","['Martin McKeown', 'Z. Jane Wang']"
characterizingpetimagesusing3dspatialinformationinterventioninducedraclopridebindingchanges,Characterizing PET images using 3D spatial information: Intervention-induced raclopride binding changes,"['Silke Cresswell', 'Vesna Sossi']",,,,dopaminereplacementremediatesriskaversioninparkinsonsdiseaseinavalueindependentmanner,Dopamine replacement remediates risk aversion in Parkinson's disease in a value-independent manner,Dopamine replacement remediates risk aversion in Parkinson's disease in a value-independent manner,"['Martin McKeown', 'A Jon Stoessl', 'Silke Cresswell']","['Martin McKeown', 'A Jon Stoessl', 'Silke Cresswell']"
forcedependentinterhemisphericconnectivityinparkinsonsdiseasepd,Force-dependent interhemispheric connectivity in Parkinson's disease (PD),"['Martin McKeown', 'Z. Jane Wang']",,,,differencesintheemergentcodingpropertiesofcorticalandstriatalensembles,Differences in the emergent coding properties of cortical and striatal ensembles,Differences in the emergent coding properties of cortical and striatal ensembles,"['Anthony Phillips', 'Jeremy Seamans']","['Anthony Phillips', 'Jeremy Seamans']"
quantitativefluorescencelifetimeimaginguncoversanovelroleforkcc2chloridetransportindendriticmicrodomains,Quantitative fluorescence lifetime imaging uncovers a novel role for kcc2 chloride transport in dendritic microdomains,"['Brian MacVicar', 'Jeffrey LeDue']",,,,highspeedfluoroscopytomeasuredynamicspinalcorddeformationinaninvivoratmodel,High-Speed Fluoroscopy to Measure Dynamic Spinal Cord Deformation in an In Vivo Rat Model,High-Speed Fluoroscopy to Measure Dynamic Spinal Cord Deformation in an in Vivo Rat Model,"['Peter Cripton', 'Wolfram Tetzlaff']","['Peter Cripton', 'Wolfram Tetzlaff']"
universityofbritishcolumbia,University of British Columbia,"['Martin McKeown', 'Brian D. Fisher']",,,,d1receptormodulationofhippocampalprefrontalcorticalcircuitsintegratingspatialmemorywithexecutivefunctionsintherat,D1 receptor modulation of hippocampal–prefrontal cortical circuits integrating spatial memory with executive functions in the rat,D<inf>1</inf> receptor modulation of hippocampal-prefrontal cortical circuits integrating spatial memory with executive functions in the rat,"['Anthony Phillips', 'Jeremy Seamans']","['Anthony Phillips', 'Jeremy Seamans']"
roleofdatinsynapticdopamineoscillationsinparkinsonsdiseaseaapetstudy,Role of DAT in synaptic dopamine oscillations in Parkinson's diseasea: A PET study,"['A Jon Stoessl', 'Vesna Sossi']",,,,front2backsingleview3dshapereconstructionviafronttobackprediction,Front2back: Single view 3d shape reconstruction via front to back prediction,Front2Back: Single View 3D Shape Reconstruction via Front to Back Prediction,"['Leonid Sigal', 'Helge Rhodin']","['Leonid Sigal', 'Helge Rhodin']"
exercisealtersresponseofrewardanticipationintheventralstriatumofsubjectswithparkinsonsdisease,Exercise alters response of reward anticipation in the ventral striatum of subjects with Parkinson's disease,"['Martin McKeown', 'A Jon Stoessl', 'Silke Cresswell', 'Vesna Sossi']",,,,targetedischemicstrokeinductionandmesoscopicimagingassessmentofbloodflowandischemicdepolarizationinawakemice,Targeted ischemic stroke induction and mesoscopic imaging assessment of blood flow and ischemic depolarization in awake mice,Targeted ischemic stroke induction and mesoscopic imaging assessment of blood flow and ischemic depolarization in awake mice,"['Tim H. Murphy', 'Jeffrey LeDue']","['Tim H. Murphy', 'Jeffrey LeDue']"
serotonintransporterbindingandmotoronsetofparkinsonsdiseaseinasymptomaticlrrk2mutationcarriersacrosssectionalstudy,Serotonin transporter binding and motor onset of Parkinson's disease in asymptomatic LRRK2 mutation carriers: a cross-sectional study,"['A Jon Stoessl', 'Vesna Sossi']",,,,chronicpregabalintreatmentprotectsagainstspreadingdepolarizationandaltershippocampalsynapticcharacteristicsinamodeloffamilialhemiplegicmigrainetype1,Chronic pregabalin treatment protects against spreading depolarization and alters hippocampal synaptic characteristics in a model of familial hemiplegic migraine-type 1,Chronic pregabalin treatment protects against spreading depolarization and alters hippocampal synaptic characteristics in a model of familial hemiplegic migraine-type 1,"['Brian MacVicar', 'Terry Snutch']","['Brian MacVicar', 'Terry Snutch']"
effectofdopaminelossandthemetabolite3omethyl18ffluorodopaontherelationbetweenthe18ffluorodopatissueinputuptakerateconstantkoccandthe18f,Effect of Dopamine Loss and the Metabolite 3-O-Methyl-[18F]Fluoro-dopa on the Relation between the 18F-Fluorodopa Tissue Input Uptake Rate Constant Kocc and the [18F …,"['A Jon Stoessl', 'Vesna Sossi']",,,,anautomatedhomecagesystemtoassesslearningandperformanceofaskilledmotortaskinamousemodelofhuntingtonsdisease,An automated home-cage system to assess learning and performance of a skilled motor task in a mouse model of Huntington’s disease,An automated home-cage system to assess learning and performance of a skilled motor task in a mouse model of huntington’s disease,"['Tim H. Murphy', 'Lynn Raymond']","['Tim H. Murphy', 'Lynn Raymond']"
braincommunicationsaincommunications,BRAIN COMMUNICATIONS AIN COMMUNICATIONS,"['Brian MacVicar', 'Terry Snutch', 'Ian Mackenzie']",,,,brainconnectivityassessedwithfunctionalmri,Brain Connectivity Assessed with Functional MRI,Brain connectivity assessed with functional MRI,"['Martin McKeown', 'Z. Jane Wang']","['Martin McKeown', 'Z. Jane Wang']"
positronemissiontomographydemonstratesreduceddopaminetransporterexpressioninpdpatientswithdyskinesia,Positron emission tomography demonstrates reduced dopamine transporter expression in PD patients with dyskinesia,"['A Jon Stoessl', 'Vesna Sossi']",,,,xctcystinetransporterexpressioninhek293cellspharmacologyandlocalization,xCt cystine transporter expression in HEK293 cells: pharmacology and localization,xCT cystine transporter expression in HEK293 cells: Pharmacology and localization,"['Tim H. Murphy', 'Andy Shih']","['Tim H. Murphy', 'Andy Shih']"
alongitudinal11cdihydrotetrabenazinepetstudyofgenderdifferenceintheprogressionofdopaminergicdysfunctionintheparkinsoniancaudatep6064,A Longitudinal [11C](±) dihydrotetrabenazine PET Study of Gender Difference in the Progression of Dopaminergic Dysfunction in the Parkinsonian Caudate (P6. 064),"['A Jon Stoessl', 'Vesna Sossi']",,,,differentialregulationofcellproliferationinneurogeniczonesinmicelackingcystinetransportbyxct,Differential regulation of cell proliferation in neurogenic zones in mice lacking cystine transport by xCT,Differential regulation of cell proliferation in neurogenic zones in mice lacking cystine transport by xCT,"['Tim H. Murphy', 'Craig E. Brown']","['Tim H. Murphy', 'Craig E. Brown']"
theinfluenceoflrrk2mutationsoncholinergicsysteminmanifestandprodromalstageofparkinsonsdiseaseapositronemissiontomographystudy,The influence of LRRK2 mutations on cholinergic system in manifest and prodromal stage of Parkinson's disease: a positron emission tomography study,"['Martin McKeown', 'A Jon Stoessl', 'Vesna Sossi']",,,,dopaminereleaseinhumanventralstriatumandexpectationofreward,Dopamine release in human ventral striatum and expectation of reward,Dopamine release in human ventral striatum and expectation of reward,"['A Jon Stoessl', 'Anthony Phillips', 'Vesna Sossi']","['A Jon Stoessl', 'Anthony Phillips', 'Vesna Sossi']"
invivoandnoninvasiveanalysisofspinalcorddeformationsforrodentresearchusingmagneticresonanceimaging,In vivo and non-invasive analysis of spinal cord deformations for rodent research using magnetic resonance imaging,"['Peter Cripton', 'Wolfram Tetzlaff']",,,,heantos4anaturalplantextractusedinthetreatmentofdrugaddictionmodulatesttypecalciumchannelsandthalamocorticalburstfiring,"Heantos-4, a natural plant extract used in the treatment of drug addiction, modulates T-type calcium channels and thalamocortical burst-firing","Heantos-4, a natural plant extract used in the treatment of drug addiction, modulates T-type calcium channels and thalamocortical burst-firing","['Anthony Phillips', 'Terry Snutch']","['Anthony Phillips', 'Terry Snutch']"
effectofexerciseonbrainmetabolismandenergeticsinpd,Effect of exercise on brain metabolism and energetics in PD,"['A Jon Stoessl', 'Vesna Sossi']",,,,randomizedtrialofintermittentintraputamenalglialcelllinederivedneurotrophicfactorinparkinsonsdisease,Randomized trial of intermittent intraputamenal glial cell line-derived neurotrophic factor in Parkinson’s disease,Randomized trial of intermittent intraputamenal glial cell line-derived neurotrophic factor in Parkinson's disease,"['A Jon Stoessl', 'Vesna Sossi']","['A Jon Stoessl', 'Vesna Sossi']"
criticalperiodforstimulationduringdevelopment,Critical Period for Stimulation During Development,"['Catharine Rankin', 'Liisa Galea']",,,,shrinkagetotaperingestimationoflargecovariancematrices,Shrinkage-to-tapering estimation of large covariance matrices,Shrinkage-to-tapering estimation of large covariance matrices,"['Martin McKeown', 'Z. Jane Wang']","['Martin McKeown', 'Z. Jane Wang']"
correlationanalysisbetweendopaminereleaseinstriatalsubregionsandmotorimpairmentinparkinsonsdiseasesubjects,Correlation analysis between dopamine release in striatal sub-regions and motor impairment in Parkinson's disease subjects,"['Lara Boyd', 'A Jon Stoessl', 'Vesna Sossi']",,,,towardsavisualizabledeidentifiedsyntheticbiomarkerofhumanmovementdisorders,"Towards a Visualizable, De-identified Synthetic Biomarker of Human Movement Disorders","Towards a Visualizable, De-identified Synthetic Biomarker of Human Movement Disorders","['Tim H. Murphy', 'Helge Rhodin']","['Tim H. Murphy', 'Helge Rhodin']"
amultimodalframeworkforjointkinematicandeegdataanalysisduringahapticreachingtaskinparkinsonsdisease,A Multimodal Framework for Joint Kinematic and EEG Data Analysis during a Haptic Reaching Task in Parkinson’s Disease,"['Martin McKeown', 'Z. Jane Wang']",,,,multimodalimagingofsubstantianigrainparkinsonsdiseasewithlevodopainduceddyskinesia,Multimodal Imaging of Substantia Nigra in Parkinson's Disease with Levodopa‐Induced Dyskinesia,Multimodal Imaging of Substantia Nigra in Parkinson's Disease with Levodopa-Induced Dyskinesia,"['A Jon Stoessl', 'Vesna Sossi']","['A Jon Stoessl', 'Vesna Sossi']"
comparisonofagerelatedchangesinthenormalstriatumbetweendopaminergicpettracersevidenceforthedownregulationofdopaminetransporterswithaging,Comparison of age-related changes in the normal striatum between dopaminergic PET tracers: evidence for the downregulation of dopamine transporters with aging,"['A Jon Stoessl', 'Vesna Sossi']",,,,petdemonstratesreduceddopaminetransporterexpressioninpdwithdyskinesias,PET demonstrates reduced dopamine transporter expression in PD with dyskinesias,PET demonstrates reduced dopamine transporter expression in PD with dyskinesias,"['A Jon Stoessl', 'Vesna Sossi']","['A Jon Stoessl', 'Vesna Sossi']"
researchday2010,RESEARCH DAY 2010,"['Fidel Vila-Rodriguez', 'Todd Woodward']",,,,disruptionofampareceptorendocytosisimpairstheextinctionbutnotacquisitionoflearnedfear,"Disruption of AMPA receptor endocytosis impairs the extinction, but not acquisition of learned fear","Disruption of AMPA receptor endocytosis impairs the extinction, but not acquisition of learned fear","['Anthony Phillips', 'Yu Tian Wang']","['Anthony Phillips', 'Yu Tian Wang']"
remappingoffmrifunctionalconnectivityduringrestingstateinmultiplesclerosisrepresentscompensatorymechanismsp6146,Remapping of fMRI functional connectivity during resting state in multiple sclerosis represents compensatory mechanisms (P6. 146),"['Martin McKeown', 'Z. Jane Wang']",,,,expectationanddopaminereleasemechanismoftheplaceboeffectinparkinsonsdisease,Expectation and dopamine release: mechanism of the placebo effect in Parkinson's disease,Expectation and dopamine release: Mechanism of the placebo effect in Parkinson's disease,"['A Jon Stoessl', 'Vesna Sossi']","['A Jon Stoessl', 'Vesna Sossi']"
