GS ONLY publications,GS ONLY title,GS ONLY coauthors,SV ONLY publications,SV ONLY title,SV ONLY coauthors,shared publications,shared gs title,shared sv title,shared gs coauthors,shared sv coauthors
neuralnetmodelinsightsintobasalgangliafunction,NEURAL-NET MODEL INSIGHTS INTO BASAL GANGLIA FUNCTION,"['Martin McKeown', 'A Jon Stoessl']",petstudyof18f6fluoroldopauptakeinneurolepticandmoodstabilizernaivefirstepisodenonpsychoticmaniaeffectsoftreatmentwithdivalproexsodium,PET study of [<sup>18</sup>F]6-fluoro-L-dopa uptake in neuroleptic and mood-stabilizer-naive first-episode nonpsychotic mania: Effects of treatment with divalproex sodium,"['A Jon Stoessl', 'Vesna Sossi']",ageandseverityofnigrostriataldamageatonsetofparkinsonsdisease,Age and severity of nigrostriatal damage at onset of Parkinson's disease,Age and severity of nigrostriatal damage at onset of Parkinson's disease,"['A Jon Stoessl', 'Vesna Sossi']","['A Jon Stoessl', 'Vesna Sossi']"
p237918ffluorodeoxyglucosepositronemissiontomographyinpresymptomaticprogranulinmutationcarriers,P2‐379:(18) F‐Fluorodeoxyglucose positron emission tomography in presymptomatic progranulin mutation carriers,"['A Jon Stoessl', 'Ian Mackenzie', 'Vesna Sossi']",astickyweightedregressionmodelfortimevaryingrestingstatebrainconnectivityestimation,A sticky weighted regression model for time-varying resting-state brain connectivity estimation,"['Martin McKeown', 'Z. Jane Wang']",nrf2genedeletionfailstoalterpsychostimulantinducedbehaviororneurotoxicity,Nrf2 gene deletion fails to alter psychostimulant-induced behavior or neurotoxicity,Nrf2 gene deletion fails to alter psychostimulant-induced behavior or neurotoxicity,"['Tim H. Murphy', 'Andy Shih']","['Tim H. Murphy', 'Andy Shih']"
smallpvaluesmaynotyieldrobustfindingsanexampleusingrestmetapd,Small P values may not yield robust findings: an example using REST-meta-PD,"['Martin McKeown', 'Z. Jane Wang']",distinctbutoverlappingrolesoflrrtm1andlrrtm2indevelopingandmaturehippocampalcircuits,Distinct but overlapping roles of LRRTM1 and LRRTM2 in developing and mature hippocampal circuits,"['Shernaz Bamji', 'Yu Tian Wang']",invivoimagingrevealsthatpregabalininhibitscorticalspreadingdepressionandpropagationtosubcorticalbrainstructures,In vivo imaging reveals that pregabalin inhibits cortical spreading depression and propagation to subcortical brain structures,In vivo imaging reveals that pregabalin inhibits cortical spreading depression and propagation to subcortical brain structures,"['Brian MacVicar', 'Terry Snutch', 'Jeffrey LeDue']","['Brian MacVicar', 'Terry Snutch', 'Jeffrey LeDue']"
hiddenmarkovmultivariateautoregressivehmmmarmodelingofdynamicmuscleassociationpatternsinreachingmovements,Hidden Markov multivariate autoregressive (HMM-mAR) modeling of dynamic muscle association patterns in reaching movements,"['Martin McKeown', 'Z. Jane Wang']",projectionbasedphasefeaturesforlocalizationofaneedletipin2dcurvilinearultrasound,Projection-based phase features for localization of a needle tip in 2D curvilinear ultrasound,"['Ilker Hacihaliloglu', 'Purang Abolmaesumi']",blockofvoltagegatedcalciumchannelsstimulatesdopamineeffluxinratmesocorticolimbicsystem,Block of voltage-gated calcium channels stimulates dopamine efflux in rat mesocorticolimbic system,Block of voltage-gated calcium channels stimulates dopamine efflux in rat mesocorticolimbic system,"['Anthony Phillips', 'Terry Snutch']","['Anthony Phillips', 'Terry Snutch']"
alteredfunctionaltopographyofthestriatuminrestingstatefmriinparkinsonsdisease,Altered functional topography of the striatum in resting state fMRI in Parkinson's disease,"['Martin McKeown', 'Z. Jane Wang']",probabilisticbooleannetworkforinferringbrainconnectivityusingfmridata,Probabilistic Boolean Network for inferring brain connectivity using fMRI data,"['Martin McKeown', 'Z. Jane Wang']",autosomaldominantdystoniapluswithcerebralcalcifications,Autosomal dominant dystonia-plus with cerebral calcifications,Autosomal dominant dystonia-plus with cerebral calcifications,"['A Jon Stoessl', 'Ian Mackenzie']","['A Jon Stoessl', 'Ian Mackenzie']"
8brainconnectivity,8 Brain Connectivity,"['Martin McKeown', 'Z. Jane Wang']",corrigendumtoevaluationofthewistarkyotoratmodelofdepressionandtheroleofsynapticplasticityindepressionandantidepressantresponseneuroscibiobehavrev1052019123neuroscienceandbiobehavioralreviews2019105123s0149763419303483101016jneubiorev201907007,"Corrigendum to “Evaluation of the Wistar-Kyoto rat model of depression and the role of synaptic plasticity in depression and antidepressant response” [Neurosci. Biobehav. Rev. 105 (2019) 1–23] (Neuroscience and Biobehavioral Reviews (2019) 105 (1–23), (S0149763419303483), (10.1016/j.neubiorev.2019.07.007))","['Anthony Phillips', 'Yu Tian Wang']",anovelsegmentationmutualinformationnetworkframeworkforeeganalysisofmotortasks,"A novel segmentation, mutual information network framework for EEG analysis of motor tasks","A novel segmentation, mutual information network framework for EEG analysis of motor tasks","['Martin McKeown', 'Z. Jane Wang']","['Martin McKeown', 'Z. Jane Wang']"
detectingtwotaskdopaminereleaseviaresidualanalysis,Detecting two-task dopamine release via residual analysis,"['A Jon Stoessl', 'Vesna Sossi']",mutualinformationbasedrelevancenetworkanalysisaparkinsonsdiseasestudy,Mutual information based relevance network analysis: A Parkinson's disease study,"['Martin McKeown', 'Z. Jane Wang']",longitudinalprogressionofsporadicparkinsonsdiseaseamultitracerpositronemissiontomographystudy,Longitudinal progression of sporadic Parkinson's disease: a multi-tracer positron emission tomography study,Longitudinal progression of sporadic Parkinson's disease: A multi-tracer positron emission tomography study,"['A Jon Stoessl', 'Vesna Sossi']","['A Jon Stoessl', 'Vesna Sossi']"
theneurosurgicaltreatmentofspasmodicdysphoniainterimresultsofdebussy,The Neurosurgical Treatment of Spasmodic Dysphonia: Interim Results of DEBUSSY.,"['Silke Cresswell', 'Vesna Sossi']",oscillatorypowerandsynchronyintheratforebrainarealteredbyasensitizingregimeofdamphetamine,Oscillatory power and synchrony in the rat forebrain are altered by a sensitizing regime of d-amphetamine,"['Anthony Phillips', 'Z. Jane Wang']",bayesiannetworkmodelingfordiscoveringdirectedsynergiesamongmusclesinreachingmovements,"Bayesian Network Modeling For Discovering"" Directed Synergies"" Among Muscles in Reaching Movements","Bayesian network modeling for discovering ""directed synergies"" among muscles in reaching movements","['Martin McKeown', 'Z. Jane Wang']","['Martin McKeown', 'Z. Jane Wang']"
emergingneuroimagingtechnologiestowardsfuturepersonalizeddiagnosticsprognosistargetedinterventionandethicalchallenges,"Emerging neuroimaging technologies: Towards future personalized diagnostics, prognosis, targeted intervention and ethical challenges","['Todd Woodward', 'Vesna Sossi']",movementdisorders,Movement disorders,"['Martin McKeown', 'A Jon Stoessl']",invivopositronemissiontomographicevidenceforcompensatorychangesinpresynapticdopaminergicnerveterminalsinparkinsonsdisease,In vivo positron emission tomographic evidence for compensatory changes in presynaptic dopaminergic nerve terminals in Parkinson's disease,In vivo positron emission tomographic evidence for compensatory changes in presynaptic dopaminergic nerve terminals in Parkinson's disease,"['A Jon Stoessl', 'Vesna Sossi']","['A Jon Stoessl', 'Vesna Sossi']"
novelspatialanalysismethodforpetdatausing3dmomentinvariantsapplicationstoparkinsonsdisease,Novel spatial analysis method for PET data using 3D moment invariants: applications to Parkinson's disease,"['Martin McKeown', 'Silke Cresswell', 'Vesna Sossi']",facilitatedextinctionofmorphineconditionedplacepreferencewithtatglua23yinterferencepeptide,Facilitated extinction of morphine conditioned place preference with Tat-GluA2<inf>3Y</inf> interference peptide,"['Anthony Phillips', 'Yu Tian Wang']",noniterativepartialview3dultrasoundtoctregistrationinultrasoundguidedcomputerassistedorthopedicsurgery,Non-iterative partial view 3D ultrasound to CT registration in ultrasound-guided computer-assisted orthopedic surgery,Non-iterative partial view 3D ultrasound to CT registration in ultrasound-guided computer-assisted orthopedic surgery,"['Ilker Hacihaliloglu', 'Purang Abolmaesumi']","['Ilker Hacihaliloglu', 'Purang Abolmaesumi']"
influencesofgenderdepressionanddiseaseseverityonmocasubscoresinparksinonsdisease,"Influences of Gender, Depression and Disease Severity on Moca Subscores in Parksinon's Disease","['Martin McKeown', 'Silke Cresswell']",galvanicvestibularstimulationgvsaugmentsdeficientpedunculopontinenucleusppnconnectivityinmildparkinsonsdiseasefmrieffectsofdifferentstimuli,Galvanic Vestibular Stimulation (GVS) Augments Deficient Pedunculopontine Nucleus (PPN) Connectivity in Mild Parkinson's Disease: fMRI Effects of Different Stimuli,"['Martin McKeown', 'Z. Jane Wang']",combinationofolfactoryensheathingcellswithlocalversussystemiccamptreatmentafteracervicalrubrospinaltractinjury,Combination of olfactory ensheathing cells with local versus systemic cAMP treatment after a cervical rubrospinal tract injury,Combination of olfactory ensheathing cells with local versus systemic cAMP treatment after a cervical rubrospinal tract injury,"['Wolfram Tetzlaff', 'Jane Roskams']","['Wolfram Tetzlaff', 'Jane Roskams']"
dopamineresponsetoahedonicstimulusnaturalrewardapetstudy,Dopamine response to a hedonic stimulus/natural reward: A PET study,"['Martin McKeown', 'A Jon Stoessl', 'Silke Cresswell', 'Vesna Sossi']",acombinedstaticanddynamicmodelforrestingstatebrainconnectivitynetworks,A Combined Static and Dynamic Model for Resting-State Brain Connectivity Networks,"['Martin McKeown', 'Z. Jane Wang']",multiparametricanalysisof57syngap1variantsrevealimpactsongtpasesignalinglocalizationandproteinstability,"Multi-parametric analysis of 57 SYNGAP1 variants reveal impacts on GTPase signaling, localization, and protein stability","Multi-parametric analysis of 57 SYNGAP1 variants reveal impacts on GTPase signaling, localization, and protein stability","['Paul Pavlidis', 'Kurt Haas']","['Paul Pavlidis', 'Kurt Haas']"
dopadecarboxylaseupregulationanddopaminetransporterdownregulationcompensateforstriataldopaminedeficiencyinpresymptomaticfamilialparkinsonsdisease,Dopa decarboxylase upregulation and dopamine transporter downregulation compensate for striatal dopamine deficiency in pre-symptomatic familial Parkinson's disease,"['A Jon Stoessl', 'Vesna Sossi']",emergingneuroimagingtechnologiestowardfuturepersonalizeddiagnosticsprognosistargetedinterventionandethicalchallenges,"Emerging neuroimaging technologies: Toward future personalized diagnostics, prognosis, targeted intervention, and ethical challenges","['Todd Woodward', 'Vesna Sossi']",pannexin1regulatesnetworkensemblesanddendriticspinedevelopmentincorticalneurons,Pannexin 1 regulates network ensembles and dendritic spine development in cortical neurons,Pannexin 1 regulates network ensembles and dendritic spine development in cortical neurons,"['Leigh Anne Swayne', 'Craig E. Brown']","['Leigh Anne Swayne', 'Craig E. Brown']"
effectofpopulationk2valuesingraphicalestimationofdvratiosofreversibleligands,Effect of population k2 values in graphical estimation of DV ratios of reversible ligands,"['A Jon Stoessl', 'Vesna Sossi']",noisygalvanicvestibularstimulationmodulatestheamplitudeofeegsynchronypatterns,Noisy Galvanic Vestibular Stimulation Modulates the Amplitude of EEG Synchrony Patterns,"['Martin McKeown', 'Z. Jane Wang']",mesoscaleinfraslowspontaneousmembranepotentialfluctuationsrecapitulatehighfrequencyactivitycorticalmotifs,Mesoscale infraslow spontaneous membrane potential fluctuations recapitulate high-frequency activity cortical motifs,Mesoscale infraslow spontaneous membrane potential fluctuations recapitulate high-frequency activity cortical motifs,"['Tim H. Murphy', 'Yu Tian Wang', 'Jeffrey LeDue']","['Tim H. Murphy', 'Yu Tian Wang', 'Jeffrey LeDue']"
noveldatadrivenmethodcapturesspatiotemporalpatternsofneurodegenerationinparkinsonsdisease,Novel data-driven method captures spatio-temporal patterns of neurodegeneration in Parkinson's disease,"['Martin McKeown', 'A Jon Stoessl', 'Vesna Sossi']",3dcnnbasedautomaticdiagnosisofattentiondeficithyperactivitydisorderusingfunctionalandstructuralmri,3D CNN Based Automatic Diagnosis of Attention Deficit Hyperactivity Disorder Using Functional and Structural MRI,"['Martin McKeown', 'Z. Jane Wang']",individualizedfunctionaltargetingforrtmsapowerfulideawhosetimehascome,Individualized functional targeting for rTMS: A powerful idea whose time has come?,Individualized functional targeting for rTMS: A powerful idea whose time has come?,"['Fidel Vila-Rodriguez', 'Sophia Frangou']","['Fidel Vila-Rodriguez', 'Sophia Frangou']"
mesoscalecorticalmappingrevealsregionspecificandfrequencydependentchangesinamousemodelofelectroconvulsivetherapy,Mesoscale cortical mapping reveals region-specific and frequency-dependent changes in a mouse model of electroconvulsive therapy,"['Tim H. Murphy', 'Jeffrey LeDue']",removingmuscleartifactsfromeegdatamultichannelorsinglechanneltechniques,Removing Muscle Artifacts from EEG Data: Multichannel or Single-Channel Techniques?,"['Martin McKeown', 'Z. Jane Wang']",theeffectoflrrk2mutationsonthecholinergicsysteminmanifestandpremanifeststagesofparkinsonsdiseaseacrosssectionalpetstudy,The effect of LRRK2 mutations on the cholinergic system in manifest and premanifest stages of Parkinson's disease: a cross-sectional PET study,The effect of LRRK2 mutations on the cholinergic system in manifest and premanifest stages of Parkinson's disease: a cross-sectional PET study,"['Martin McKeown', 'A Jon Stoessl', 'Vesna Sossi']","['Martin McKeown', 'A Jon Stoessl', 'Vesna Sossi']"
newinsightsintolevodopainduceddopaminereleaseinparkinsonsdisease,New insights into levodopa induced dopamine release in Parkinson's disease,"['Martin McKeown', 'A Jon Stoessl', 'Silke Cresswell', 'Vesna Sossi']",selfsupervised3dhumanposeestimationfromvideo,Self-supervised 3D human pose estimation from video,"['Z. Jane Wang', 'Helge Rhodin']",extensiveturnoverofdendriticspinesandvascularremodelingincorticaltissuesrecoveringfromstroke,Extensive turnover of dendritic spines and vascular remodeling in cortical tissues recovering from stroke,Extensive turnover of dendritic spines and vascular remodeling in cortical tissues recovering from stroke,"['Tim H. Murphy', 'Craig E. Brown']","['Tim H. Murphy', 'Craig E. Brown']"
riskpromotingeffectsofrewardpairedcuesinhumansignandgoaltrackers,Risk-Promoting Effects of Reward-Paired Cues in Human Sign-and Goal-Trackers,"['A Jon Stoessl', 'Catharine Winstanley']",lecturenotesincomputerscienceincludingsubserieslecturenotesinartificialintelligenceandlecturenotesinbioinformaticspreface,Lecture Notes in Computer Science (including subseries Lecture Notes in Artificial Intelligence and Lecture Notes in Bioinformatics): Preface,"['Brian D. Fisher', 'Purang Abolmaesumi']",greenfluorescentproteinemissionobscuresmetabolicfluorescentlifetimeimagingofnadph,Green fluorescent protein emission obscures metabolic fluorescent lifetime imaging of NAD (P) H,Green fluorescent protein emission obscures metabolic fluorescent lifetime imaging of NAD(P)H,"['Brian MacVicar', 'Jeffrey LeDue']","['Brian MacVicar', 'Jeffrey LeDue']"
brainpalmseqacuratedrnaseqdatabaseofpalmitoylatinganddepalmitoylatingenzymeexpressioninthemousebrain,BrainPalmSeq: A curated RNA-seq database of palmitoylating and de-palmitoylating enzyme expression in the mouse brain,"['Shernaz Bamji', 'Kurt Haas']",awindowedeigenspectrummethodformultivariatesemgclassificationduringreachingmovements,A windowed eigenspectrum method for multivariate sEMG classification during reaching movements,"['Martin McKeown', 'Z. Jane Wang']",patranlearningtoestimate3dhandposewithpartialannotation,PA-Tran: Learning to Estimate 3D Hand Pose with Partial Annotation,PA-Tran: Learning to Estimate 3D Hand Pose with Partial Annotation,"['Martin McKeown', 'Z. Jane Wang']","['Martin McKeown', 'Z. Jane Wang']"
alteredcorticoputaminaldticonnectivitypatternsinparkinsonsdiseaseandtheirassociationwithmotorimpairment,Altered cortico-putaminal DTI connectivity patterns in Parkinson's disease and their association with motor impairment,"['Martin McKeown', 'Silke Cresswell']",invivovoltagesensitivedyeimaginginadultmicerevealsthatsomatosensorymapslosttostrokearereplacedoverweeksbynewstructuralandfunctionalcircuitswithprolongedmodesofactivationwithinboththeperiinfarctzoneanddistantsites,In vivo voltage-sensitive dye imaging in adult mice reveals that somatosensory maps lost to stroke are replaced over weeks by new structural and functional circuits with prolonged modes of activation within both the peri-infarct zone and distant sites,"['Tim H. Murphy', 'Craig E. Brown']",cttousregistrationofthelumbarspineaclinicalfeasibilitystudy,CT to US registration of the lumbar spine: a clinical feasibility study,CT to US registration of the lumbar spine: A clinical feasibility study,"['Ilker Hacihaliloglu', 'Purang Abolmaesumi']","['Ilker Hacihaliloglu', 'Purang Abolmaesumi']"
multimodelfunctionalizationof106ptenmissensemutationsidentifiesmultiplemolecularmechanismsunderlyingproteindysfunction,Multi-Model Functionalization of 106 PTEN Missense Mutations Identifies Multiple Molecular Mechanisms Underlying Protein Dysfunction,"['Shernaz Bamji', 'Paul Pavlidis', 'Kurt Haas', 'Catharine Rankin']",interferencepeptidesanoveltherapeuticapproachtargetingsynapticplasticityindrugaddiction,Interference peptides: A novel therapeutic approach targeting synaptic plasticity in drug addiction,"['Anthony Phillips', 'Yu Tian Wang']",analysisoffourdopaminergictracerskineticsusingtwodifferenttissueinputfunctionmethods,Analysis of four dopaminergic tracers kinetics using two different tissue input function methods,Analysis of four dopaminergic tracers kinetics using two different tissue input function methods,"['A Jon Stoessl', 'Vesna Sossi']","['A Jon Stoessl', 'Vesna Sossi']"
2121broadbanddirectionaleegconnectivitychangesduringmotorpreparationpredictsparkinsonsdiseaseseverity,2.121 BROAD-BAND DIRECTIONAL EEG CONNECTIVITY CHANGES DURING MOTOR PREPARATION PREDICTS PARKINSON'S DISEASE SEVERITY,"['Martin McKeown', 'Z. Jane Wang']",sparsemultivariateautoregressivemarbasedpartialdirectedcoherencepdcforelectroencephalogrameeganalysis,Sparse multivariate autoregressive (MAR)-based partial directed coherence (PDC) for electroencephalogram (EEG) analysis,"['Martin McKeown', 'Z. Jane Wang']",locallineardiscriminantanalysislldaforinferenceofmultisubjectfmridata,Local Linear Discriminant Analysis (LLDA) For Inference Of Multisubject fMRI Data,Local linear discriminant analysis (LLDA) for inference of multisubject FMRI data,"['Martin McKeown', 'Z. Jane Wang']","['Martin McKeown', 'Z. Jane Wang']"
theeffectsofsensoryrewardcuesonriskydecisionmakinginparkinsonsdisease,The effects of sensory reward cues on risky decision making in Parkinson's disease,"['Martin McKeown', 'A Jon Stoessl', 'Catharine Winstanley', 'Silke Cresswell']",openscienceinplayandintensionwithpatentprotections,Open science in play and in tension with patent protections,"['Paul Pavlidis', 'Jeffrey LeDue']",roleofnr2btypenmdareceptorsinselectiveneurodegenerationinhuntingtondisease,Role of NR2B-type NMDA receptors in selective neurodegeneration in Huntington disease,Role of NR2B-type NMDA receptors in selective neurodegeneration in Huntington disease,"['Tim H. Murphy', 'Lynn Raymond']","['Tim H. Murphy', 'Lynn Raymond']"
highspeedradiographycanbeusedtomeasuredynamicspinalcorddeformationinaninvivorodentmodel,High Speed Radiography Can Be Used to Measure Dynamic Spinal Cord Deformation in an in vivo Rodent Model,"['Peter Cripton', 'Wolfram Tetzlaff']",amultisubjectdynamicbayesiannetworksdbnsframeworkforbraineffectiveconnectivity,"A multi-subject, dynamic Bayesian networks (DBNS) framework for brain effective connectivity","['Martin McKeown', 'Z. Jane Wang']",agespecificprogressionofnigrostriataldysfunctioninparkinsonsdisease,Age‐specific progression of nigrostriatal dysfunction in Parkinson's disease,Age-specific progression of nigrostriatal dysfunction in Parkinson's disease,"['A Jon Stoessl', 'Vesna Sossi']","['A Jon Stoessl', 'Vesna Sossi']"
specialsectiononlightmicroscopyofconnectivitynetworkanalysisofmesoscaleopticalrecordingstoassessregionalfunctionalconnectivity,"Special Section on Light Microscopy of Connectivity: Network analysis of mesoscale optical recordings to assess regional, functional connectivity","['Tim H. Murphy', 'Jeffrey LeDue']",hdacinhibitionleadstoagedependentoppositeregenerativeeffectuponptendeletioninrubrospinalaxonsaftersci,HDAC inhibition leads to age-dependent opposite regenerative effect upon PTEN deletion in rubrospinal axons after SCI,"['Wolfram Tetzlaff', 'Jane Roskams']",increasingtheeffectsizeineventrelatedfmristudies,Increasing the effect size in event-related fMRI studies,Increasing the effect size in event-related fMRI studies,"['Martin McKeown', 'Z. Jane Wang']","['Martin McKeown', 'Z. Jane Wang']"
dopaminedeficiencyisassociatedwithriskaversionbutnotlossaversioninparkinsonsdisease,Dopamine deficiency is associated with risk aversion but not loss aversion in Parkinson’s disease,"['Martin McKeown', 'A Jon Stoessl', 'Silke Cresswell']",novelregionalactivityrepresentationwithconstrainedcanonicalcorrelationanalysisforbrainconnectivitynetworkestimation,Novel Regional Activity Representation with Constrained Canonical Correlation Analysis for Brain Connectivity Network Estimation,"['Martin McKeown', 'Z. Jane Wang']",removalofhighvoltagebrainstimulationartifactsfromsimultaneouseegrecordings,Removal of high-voltage brain stimulation artifacts from simultaneous EEG recordings,Removal of High-Voltage Brain Stimulation Artifacts from Simultaneous EEG Recordings,"['Martin McKeown', 'Z. Jane Wang']","['Martin McKeown', 'Z. Jane Wang']"
systematicphenomicsanalysisofasdassociatedgenesrevealssharedfunctionsandparallelnetworksunderlyingreversibleimpairmentsinhabituationlearning,Systematic phenomics analysis of ASD-associated genes reveals shared functions and parallel networks underlying reversible impairments in habituation learning,"['Paul Pavlidis', 'Kurt Haas', 'Catharine Rankin']",removalofmuscleartifactsfromtheeegareviewandrecommendations,Removal of Muscle Artifacts from the EEG: A Review and Recommendations,"['Martin McKeown', 'Z. Jane Wang']",scaphoidfracturefixationlocalizationofbonesthroughstatisticalmodeltoultrasoundregistration,Scaphoid fracture fixation: localization of bones through statistical model to ultrasound registration,Scaphoid fracture fixation: Localization of bones through statistical model to ultrasound registration,"['Ilker Hacihaliloglu', 'Purang Abolmaesumi']","['Ilker Hacihaliloglu', 'Purang Abolmaesumi']"
25thannualcomputationalneurosciencemeetingcns2016,25th annual computational neuroscience meeting: CNS-2016,"['Sophia Frangou', 'Eric Shea-Brown']",interferencewithampareceptorendocytosiseffectsonbehaviouralandneurochemicalcorrelatesofamphetaminesensitizationinmalerats,Interference with AMPA receptor endocytosis: Effects on behavioural and neurochemical correlates of amphetamine sensitization in male rats,"['Anthony Phillips', 'Yu Tian Wang']",largecovariancematrixestimationbridgingshrinkageandtaperingapproaches,Large covariance matrix estimation: Bridging shrinkage and tapering approaches,Large covariance matrix estimation: Bridging shrinkage and tapering approaches,"['Martin McKeown', 'Z. Jane Wang']","['Martin McKeown', 'Z. Jane Wang']"
increaseddopamineturnoverapossiblecontributortotheincreasedriskofparkinsonsdiseaseinlrrk2mutationcarriers,Increased dopamine turnover: A possible contributor to the increased risk of Parkinson's disease in LRRK2 mutation carriers,"['A Jon Stoessl', 'Vesna Sossi']",preface,Preface,"['Z. Jane Wang', 'Liisa Galea', 'Brian D. Fisher', 'Purang Abolmaesumi']",aframeworkforgroupanalysisoffmridatausingdynamicbayesiannetworks,A framework for group analysis of fMRI data using dynamic Bayesian networks,A framework for group analysis of fMRI data using dynamic Bayesian networks,"['Martin McKeown', 'Z. Jane Wang']","['Martin McKeown', 'Z. Jane Wang']"
11cpbb3petinpddoesalphasynucleinpathologystartinaxonalterminals,11C-PBB3 PET in PD: does alpha-synuclein pathology start in axonal terminals?,"['A Jon Stoessl', 'Vesna Sossi']",earlyincreaseinextrasynapticnmdareceptorsignalingandexpressioncontributestophenotypeonsetinhuntingtonsdiseasemicedoi101016jneuron201001008,Early Increase in Extrasynaptic NMDA Receptor Signaling and Expression Contributes to Phenotype Onset in Huntington's Disease Mice (DOI:10.1016/j.neuron.2010.01.008),"['Tim H. Murphy', 'Lynn Raymond']",falsediscoveryratecontrollerforfunctionalbrainparcellation,False discovery rate controller for functional brain parcellation,False discovery rate controller for functional brain parcellation,"['Martin McKeown', 'Z. Jane Wang']","['Martin McKeown', 'Z. Jane Wang']"
