sep=|
Name|Name on Profile|Scholar ID|Document Count|Cited by|Cited by 5 years|h-index|h-index 5 years|i10-index|i10-index 5 years|Coauthors|Affiliation|Warning|
Tim H. Murphy|Tim H. Murphy|qJjM8hkAAAAJ|242|21571|6412|76|44|153|104|{'Andy Shih': 9, 'Lynn Raymond': 18, 'Craig E. Brown': 6, 'Jeffrey LeDue': 41, 'Terry Snutch': 1, 'Yu Tian Wang': 4, 'Brian MacVicar': 3, 'Wolfram Tetzlaff': 2, 'Helge Rhodin': 3, 'Peter Cripton': 1, 'Mark Cembrowski': 1}|University of British Columbia||
Annie Ciernia|Annie Vogel Ciernia|XAGfOIIAAAAJ|46|2036|1372|21|20|25|23|{'Brian MacVicar': 1}|University of British Columbia, Vancouver||
Brian MacVicar|Brian MacVicar|Sx3420cAAAAJ|219|22679|7776|78|40|140|82|{'Tim H. Murphy': 3, 'Jeffrey LeDue': 13, 'Annie Ciernia': 1, 'Terry Snutch': 10, 'Anthony Phillips': 1, 'Shernaz Bamji': 1, 'Yu Tian Wang': 1, 'Silke Cresswell': 1, 'Leigh Anne Swayne': 1, 'Fabio Rossi': 1, 'Ian Mackenzie': 1}|Professor, University of British Columbia||
Fidel Vila-Rodriguez|Fidel Vila-Rodriguez|VynxFpEAAAAJ|264|6047|4561|38|35|97|87|{'Sophia Frangou': 6, 'Z. Jane Wang': 1, 'Jason Snyder': 2, 'Silke Cresswell': 1, 'Ian Mackenzie': 1, 'Todd Woodward': 1}|Assistant Professor; University of British Columbia||
Shernaz Bamji|Shernaz Bamji|C832lNEAAAAJ|61|5409|1456|33|23|40|36|{'Brian MacVicar': 1, 'Ian Mackenzie': 1, 'Lynn Raymond': 2, 'Paul Pavlidis': 2, 'Kurt Haas': 6, 'Catharine Rankin': 2, 'Terry Snutch': 1, 'Anthony Phillips': 1}|Professor, University of British Columbia||
Lara Boyd|Lara Boyd|yutn3mwAAAAJ|363|15727|8692|65|46|166|143|{'Martin McKeown': 2, 'A Jon Stoessl': 2, 'Silke Cresswell': 1, 'Vesna Sossi': 2, 'Todd Woodward': 3, 'Liisa Galea': 1}|Professor, University of British Columbia||
Paul Pavlidis|Paul Pavlidis|ataejQQAAAAJ|247|17999|5703|70|43|140|111|{'Shernaz Bamji': 2, 'Kurt Haas': 6, 'Catharine Rankin': 6, 'Terry Snutch': 1, 'Sophia Frangou': 1, 'Vesna Sossi': 1}|Professor of Psychiatry, University of British Columbia||
Martin McKeown|Martin J. McKeown|cBAT2tQAAAAJ|371|16865|5617|48|35|150|96|{'Lara Boyd': 2, 'A Jon Stoessl': 29, 'Silke Cresswell': 33, 'Vesna Sossi': 21, 'Z. Jane Wang': 74, 'Brian D. Fisher': 1, 'Peyman Servati': 1, 'Catharine Winstanley': 1}|Professor and Head, Division of Neurology, University of British Columbia||
A Jon Stoessl|A Jon Stoessl OR jon Stoessl|KnhWIqwAAAAJ|454|31245|8885|79|46|236|135|{'Lara Boyd': 2, 'Martin McKeown': 29, 'Silke Cresswell': 25, 'Vesna Sossi': 135, 'Catharine Winstanley': 3, 'Anthony Phillips': 2, 'Ian Mackenzie': 6, 'Terry Snutch': 1}|University of British Columbia||
Peter Cripton|Peter Cripton|hm6fJTkAAAAJ|285|7933|3410|47|32|117|85|{'Tim H. Murphy': 1, 'Mark Cembrowski': 1, 'Jeffrey LeDue': 1, 'Wolfram Tetzlaff': 14, 'Catharine Winstanley': 1}|Professor of Biomedical Engineering, University of British Columbia||
Jason Snyder|Jason S. Snyder|B6Fe4-4AAAAJ|40|6113|2038|21|19|28|27|{'Fidel Vila-Rodriguez': 2}|Associate Professor, University of British Columbia||
Wolfram Tetzlaff|Wolfram Tetzlaff|HgUvr-IAAAAJ|314|24845|6241|81|39|187|113|{'Tim H. Murphy': 2, 'Peter Cripton': 14, 'Fabio Rossi': 1, 'Jane Roskams': 9, 'Silke Cresswell': 1}|Professor and Principal Investigator ICORD (International Collaboration on Repair Discoveries), UBC||
Anthony Phillips|Anthony Phillips|cHBZKa4AAAAJ|429|37495|7246|104|39|289|114|{'Brian MacVicar': 1, 'Shernaz Bamji': 1, 'A Jon Stoessl': 2, 'Vesna Sossi': 2, 'Jeremy Seamans': 16, 'Yu Tian Wang': 11, 'Todd Woodward': 1, 'Catharine Winstanley': 1, 'Terry Snutch': 3}|University of British Columbia||
Catharine Winstanley|Catharine A. Winstanley|62UFkZcAAAAJ|185|11457|4056|47|35|96|88|{'Martin McKeown': 1, 'A Jon Stoessl': 3, 'Silke Cresswell': 1, 'Peter Cripton': 1, 'Anthony Phillips': 1, 'Vesna Sossi': 3, 'Jeremy Seamans': 1}|University of British Columbia||
Yu Tian Wang|Yu Tian Wang|oUJOq0EAAAAJ|200|42668|13601|78|50|149|115|{'Tim H. Murphy': 4, 'Jeffrey LeDue': 2, 'Brian MacVicar': 1, 'Anthony Phillips': 11, 'Jeremy Seamans': 1, 'Lynn Raymond': 3, 'Catharine Rankin': 1}|University of British Columbia||
Jeremy Seamans|Jeremy K Seamans|cDn0toMAAAAJ|108|15935|3354|50|30|66|50|{'Anthony Phillips': 16, 'Yu Tian Wang': 1, 'Catharine Winstanley': 1, 'Todd Woodward': 1}|University of British Columbia||
Terry Snutch|Snutch|mTkQFQ8AAAAJ|466|34666|9170|92|42|224|135|{'Tim H. Murphy': 1, 'Brian MacVicar': 10, 'Jeffrey LeDue': 3, 'Ian Mackenzie': 1, 'Shernaz Bamji': 1, 'Paul Pavlidis': 1, 'A Jon Stoessl': 1, 'Anthony Phillips': 3, 'Catharine Rankin': 1}|University of British Columbia||
Ian Mackenzie|Ian Mackenzie|Hx14DYYAAAAJ|503|60279|22733|105|64|240|191|{'Brian MacVicar': 1, 'Terry Snutch': 1, 'Fidel Vila-Rodriguez': 1, 'Shernaz Bamji': 1, 'Lynn Raymond': 3, 'A Jon Stoessl': 6, 'Vesna Sossi': 6}|Division of Neuropathology, Department of Pathology and Lab Medicine, University of British Columbia||
Lynn Raymond|Lynn A Raymond|VyLG_CgAAAAJ|173|20105|5319|75|35|124|98|{'Tim H. Murphy': 18, 'Shernaz Bamji': 2, 'Ian Mackenzie': 3, 'Yu Tian Wang': 3, 'Jeffrey LeDue': 2}|Professor of Psychiatry, University of British Columbia, Huntington Study Group, Predict-HD||
Kurt Haas|Kurt Haas|zLPRoXUAAAAJ|74|3773|805|26|16|38|20|{'Shernaz Bamji': 6, 'Paul Pavlidis': 6, 'Catharine Rankin': 5}|Full Professor of Neuroscience, University of British Columbia||
Mark Cembrowski|Mark S. Cembrowski|f_ILrbMAAAAJ|35|2101|1552|17|17|19|17|{'Tim H. Murphy': 1, 'Peter Cripton': 1, 'Jeffrey LeDue': 1}|Assistant Professor, University of British Columbia||
Fabio Rossi|Fabio MV Rossi|K1VQtgwAAAAJ|140|17313|6201|56|37|99|74|{'Brian MacVicar': 1, 'Wolfram Tetzlaff': 1}|Professor of Medical Genetics, University of British Columbia||
Jane Roskams|A. Jane Roskams|nzIRBZ0AAAAJ|68|6170|803|40|17|51|32|{'Wolfram Tetzlaff': 9}|University of British Columbia/Washington||
Catharine Rankin|Rankin Catharine H|KM6fM-MAAAAJ|209|7709|3094|43|27|81|57|{'Shernaz Bamji': 2, 'Paul Pavlidis': 6, 'Kurt Haas': 5, 'Yu Tian Wang': 1, 'Terry Snutch': 1, 'Liisa Galea': 1}|University of British Columbia||
Michael Gordon|Michael Gordon|WVStjbgAAAAJ|34|4178|1379|20|16|25|21||University of British Columbia||
Leonid Sigal|Leonid Sigal|P2mG6rcAAAAJ|237|13823|6602|57|43|125|102|{'Helge Rhodin': 1}|Professor, University of British Columbia||
Z. Jane Wang|Z. Jane Wang|W75uTm8AAAAJ|454|14387|8813|57|43|225|168|{'Fidel Vila-Rodriguez': 1, 'Martin McKeown': 74, 'Silke Cresswell': 4, 'Peyman Servati': 2, 'Helge Rhodin': 1}|Professor of Electrical and Computer Engineering Dept., University of British Columbia, Canada||
Peyman Servati|Peyman Servati|bl8U3JoAAAAJ|295|9700|3662|45|30|117|66|{'Martin McKeown': 1, 'Z. Jane Wang': 2}|Electrical and Computer Engineering, University of British Columbia||
Liisa Galea|Liisa Galea|Q--hI3oAAAAJ|299|22837|7977|81|48|177|148|{'Lara Boyd': 1, 'Catharine Rankin': 1, 'Sophia Frangou': 1}|Treliving Family Chair in Women's Mental Health, Senior Scientist, Centre for Addiction and Mental||
Sophia Frangou|Sophia Frangou|iRcTmwkAAAAJ|640|27758|10069|88|52|251|197|{'Fidel Vila-Rodriguez': 6, 'Paul Pavlidis': 1, 'Vesna Sossi': 1, 'Liisa Galea': 1, 'Eric Shea-Brown': 1, 'Randy Mcintosh': 3}|Icahn School of Medicine at Mount SInai||
Silke Cresswell|Silke Appel-Cresswell|OrRZGCQAAAAJ|99|4523|2284|24|19|34|31|{'Brian MacVicar': 1, 'Fidel Vila-Rodriguez': 1, 'Lara Boyd': 1, 'Martin McKeown': 33, 'A Jon Stoessl': 25, 'Vesna Sossi': 15, 'Z. Jane Wang': 4, 'Catharine Winstanley': 1, 'Wolfram Tetzlaff': 1}|Associate Professor, University of British Columbia||
Helge Rhodin|Helge Rhodin|2maWWboAAAAJ|85|5018|4561|26|25|39|39|{'Tim H. Murphy': 3, 'Jeffrey LeDue': 1, 'Leonid Sigal': 1, 'Z. Jane Wang': 1}|Assistant Professor at UBC||
Manu Madhav|Manu S Madhav|OzV0TFoAAAAJ|28|442|312|9|9|9|8||Assistant Professor, University of British Columbia||
Brian D. Fisher|Brian D. Fisher|1NGZwzoAAAAJ|192|3612|1244|31|19|52|30|{'Martin McKeown': 1}|Professor of Interactive Arts and Technology, Simon Fraser University||
Leigh Anne Swayne|Leigh Anne Swayne|6N7x3_wAAAAJ|66|2093|985|27|20|44|33|{'Brian MacVicar': 1, 'Craig E. Brown': 1}|Professor, University of Victoria||
Craig E. Brown|Craig E. Brown|JpTDgvYAAAAJ|39|3036|1170|23|19|31|23|{'Tim H. Murphy': 6, 'Leigh Anne Swayne': 1}|University of Victoria, University of British Columbia||
Adrienne Fairhall|Adrienne Fairhall|Qd2_0VkAAAAJ|121|6070|2576|37|24|59|47|{'Eric Shea-Brown': 3}|Professor of Physiology and Biophysics, University of Washington||
Eric Shea-Brown|Eric Shea-Brown|GyvbrjcAAAAJ|199|8037|3360|41|28|78|60|{'Sophia Frangou': 1, 'Adrienne Fairhall': 3}|Applied Mathematics, University of Washington||
Emily Sylwestrak|Emily Sylwestrak|gKtP4d4AAAAJ|17|1955|1315|10|9|10|9||University of Oregon|Affiliation does not match!|
Andy Shih|Andy Y. Shih|NcqRyesAAAAJ|88|8240|4209|42|35|59|53|{'Tim H. Murphy': 9}|Seattle Children's Research Institute & University of Washington||
Todd Woodward|Todd S. Woodward|72W33RkAAAAJ|297|14047|5152|66|36|163|119|{'Fidel Vila-Rodriguez': 1, 'Lara Boyd': 3, 'Anthony Phillips': 1, 'Jeremy Seamans': 1, 'Vesna Sossi': 1}|Professor, University of British Columbia||
Jeffrey LeDue|Jeffrey LeDue|1ffeRR4AAAAJ|72|2707|1711|27|24|38|33|{'Tim H. Murphy': 41, 'Brian MacVicar': 13, 'Yu Tian Wang': 2, 'Helge Rhodin': 1, 'Peter Cripton': 1, 'Mark Cembrowski': 1, 'Terry Snutch': 3, 'Lynn Raymond': 2}|University of British Columbia||
Ilker Hacihaliloglu|Ilker Hacihaliloglu|dA7G64kAAAAJ|117|2831|2244|25|20|48|38|{'Purang Abolmaesumi': 11}|Department of Radiology, Department of Medicine, University of British Columbia||
Randy Mcintosh|Anthony Randal McIntosh|Ep3N640AAAAJ|476|48560|14019|111|61|278|195|{'Sophia Frangou': 3}|Professor, Simon Fraser University||
Purang Abolmaesumi|Purang Abolmaesumi|gKZS5-IAAAAJ|463|10081|5067|50|35|215|124|{'Ilker Hacihaliloglu': 11}|Department of Electrical and Computer Engineering, University of British Columbia, V6T 1Z4||
Vesna Sossi|Vesna Sossi|5VQTWXgAAAAJ|510|18617|6407|61|40|189|118|{'Lara Boyd': 2, 'Martin McKeown': 21, 'A Jon Stoessl': 135, 'Silke Cresswell': 15, 'Paul Pavlidis': 1, 'Sophia Frangou': 1, 'Anthony Phillips': 2, 'Ian Mackenzie': 6, 'Catharine Winstanley': 3, 'Todd Woodward': 1}|Unknown affiliation||
